Tiêu đề,Số phòng ,Vị trí,Giá ,Giá / Diện tích,Diện tích,Loại hình
BÙI XƯƠNG TRẠCH NHÀ ĐẸP ĐÓN TẾT NGÕ THẲNG TẮP Ở NGAY 40m*5T giá 7.5,5,Quận Thanh Xuân,"7,5 ",188,40,nhà ở
ℬ𝒶́𝓃 CH 2̲P̲N̲ 🔛 𝟑 𝐓𝐲̉ 5 55m2 FULL Đồ Điện Tử Vinhomes Smart City,2,Quận Nam Từ Liêm,"3,5 ",64,55,chung cư / căn hộ
C.chủ 100% - Ba Đình -60m2- ôtô,6,Quận Ba Đình,"12,9 ",215,60,nhà ở
"Cách bx nước ngầm chưa đến 1km, nhà 5 tầng xây mới phố Tựu Liệt",3,Huyện Thanh Trì,"5,8 ",193,30,nhà ở
Cách DH SPTDTT 650m 3T 38m2 22 Còn lại 1 căn vị trí rất tiềm năng,3,Huyện Chương Mỹ,"2,2 ",58,38,nhà ở
"Cái Gì Vậy, Nhà Phố Văn Cao, Ở Luôn, mặt tiền rộng, thoáng, gần phố",3,Quận Ba Đình,"6,7 ",168,40,nhà ở
Căn *** Tại Phụng Châu 4 tầng x 35m2 lô góc Ngõ trước nhà 3m .,3,Huyện Chương Mỹ,"2,3 ",66,35,nhà ở
"CẦN B,ÁN NHÀ TẬP THỂ MẶT PHỐ VIP BỜ HỒ  	•	Diện tích: 40 	•	Giá: 6,6",1,Quận Hoàn Kiếm,"6,6 ",165,40,chung cư / căn hộ
"CẦN B,ÁN NHÀ TẬP THỂ MẶT PHỐ VIP BỜ HỒ  	•	Diện tích: 40 	•	Giá: 6,6",1,Quận Hoàng Mai,"6,6 ",165,40,chung cư / căn hộ
"CẦN BÁN  NHÀ TẠI PHỐ LỤA ,VẠN PHÚC ,HÀ   GIÁ 6.7 ( thương lượng",3,Quận Hà Đông ,"6,7 ",223,30,nhà ở
CẦN BÁN - VƯƠNG THỪA VŨ 48M – DÂN XÂY - NGÕ THÔNG – 1 NGOẶT RA PHỐ,3,Quận Thanh Xuân,"7,5 ",156,48,nhà ở
Cần bán căn chung Cư Eco City Việt Hưng - Long Biên 78 giá 4.2 ,2,Quận Long Biên,"4,2 ",54,78,chung cư / căn hộ
"Cần bán căn hộ 2 phòng ngủ 65,8m Ecohome 3 Tân Xuân gần cầu Thăng Long",2,Quận Bắc Từ Liêm,"0,004","0,05",66,chung cư / căn hộ
"Cần bán căn hộ 83m2 32wc Khu đô thị Mỹ Đình 1, đường Nguyễn Cơ Thạch",3,Quận Nam Từ Liêm,4,48,83,chung cư / căn hộ
"Cần bán căn hộ Cầu Giấy 80m2, 3  cạnh ga tàu trên cao chỉ 5.2 ",3,Quận Cầu  Giấy,"5,2 ",65,80,chung cư / căn hộ
"Cần bán căn hộ tập thể hai tầng phố Điện Biên Phủ, Ba Đình.",2,Quận Ba Đình,"2,7 ",96,28,chung cư / căn hộ
"Cần bán căn tập thế, Điện Biên Phủ. Ba Đình.  56m2 . Giá trên 2 ",2,Quận Ba Đình,"2,75 ",49,56,chung cư / căn hộ
"Cần bán ccmn Triều Khúc, DT 45tr/th 42m2 6 tầng thang máy. Giá 7.5 ",10,Quận Thanh Xuân,"7,5 ",179,42,nhà ở
"Cần bán CH góc B1009 chung cư 423 Minh Khai, 98m2, 3,",3,Quận Hai Bà Trưng,"8,5 ",87,98,chung cư / căn hộ
CẦN BÁN CHUNG CƯ MINI MẶT ĐƯỜNG ĐÌNH THÔN 99m2 GIÁ CHỈ HƠN 200TR /M2 N,10,Quận Nam Từ Liêm,20,202,99,nhà ở
"Cần bán chung cư Ruby City 3 Phúc Lợi 54.6, 2. 2wc giá 2.55 ",2,Quận Long Biên,"2,55 ",47,55,chung cư / căn hộ
"Cần bán chung cư tòa C5 Nguyễn Cơ Thạch,dt 78m,2,1 vs.căn góc",2,Quận Nam Từ Liêm,"4,7 ",60,78,chung cư / căn hộ
cần bán gấp,7,Quận Hà Đông ,"5,5 ",152,36,nhà ở
"CẦN BÁN GẤP - Rẻ - BÁN NHÀ, Lĩnh , Hoàng Mai - 35m – 4T - Giá 4x ",3,Quận Hoàng Mai,"4,5 ",129,35,nhà ở
CẦN BÁN GẤP CĂN HỘ CHUNG CƯ CAO CẤP TẠI VINHOMES SMART CITY TÂY MỖ,2,Quận Nam Từ Liêm,"3,85 ",70,55,chung cư / căn hộ
CẦN BÁN GẤP CĂN HỘ CHUNG CƯ CAO CẤP TẠI VINHOMES SMART CITY TÂY MỖ,2,Quận Nam Từ Liêm,"3,85 ",70,55,chung cư / căn hộ
CẦN BÁN GẤP CĂN HỘ CHUNG CƯ CAO CẤP TẠI VINHOMES SMART CITY TÂY MỖ,2,Quận Nam Từ Liêm,"3,85 ",70,55,chung cư / căn hộ
Cần bán gấp căn Thổ Quan- TT Đống Đa - 3 gác đỗ cửa- ngõ thông tứ tung,4,Quận Đống Đa,"7,8 ",223,35,nhà ở
Cần bán gấp chung cư mini 42m2,1,Quận Ba Đình,"1,26 ",30,42,chung cư / căn hộ
"cần bán gấp chung cư Trần Quý Kiên, 65m2, 2 Ngủ, sửa đẹp giá rẻ 3,850t",2,Quận Cầu  Giấy,"3,85 ",57,68,chung cư / căn hộ
Cần bán gấp giá rẻ CHCC Imperia Sky Garden 423 Minh Khai,2,Quận Hai Bà Trưng,5,66,76,chung cư / căn hộ
CẦN BÁN GẤP LIỀN KỀ DT90M-5  KĐT VĂN PHÚ-GẦN CHỢ-KINH DOANH,5,Quận Hà Đông ,"18,7 ",208,90,nhà ở
Cần bán gấp Liền Kề Geleximco A 131m MT6.8m giá 24.5 ,5,Huyện Hoài Đức,"24,5 ",187,131,nhà ở
"Cần bán gấp nhà 3 tâng,gia lâm hà nội,DT61,6m, MT3,9m  sổ vuông giá 6x",4,Huyện Gia Lâm,"6,6 ",107,62,nhà ở
cần bán gấp nhà phố cổ,2,Quận Hoàn Kiếm,"6,7 ",223,30,nhà ở
Cần bán gấp nhà phố Láng thông phố Chùa Láng nhỉnh 11  Ô tô 20m,3,Quận Đống Đa,"11,5 ",240,48,nhà ở
"CẦN BÁN GẤP NHÀ PHỐ NGÔ GIA TỰ, DT 50M2, MT 4M, GIÁ NHỈNH 6 ",4,Quận Long Biên,"6,1 ",122,50,nhà ở
Cần bán gấp TT 80m P.Chương Dương . Mua nhà tặng hộ khẩu Hoàn Kiếm,10,Quận Hoàn Kiếm,"3,9 ",49,80,nhà ở
CẦN BÁN LK LACASTA VĂN PHÚ DT 75M-4 KINH DOANH-NGAY CỘT ĐỒNG HỒ,4,Quận Hà Đông ,"18,5 ",247,75,nhà ở
Cần Bán nhà,5,Quận Hoàn Kiếm,"6,2 ",155,40,nhà ở
CẦN BÁN NHÀ - HOÀNG QUỐC VIỆT -70.5m2 x 5TẦNG- PHÂN LÔ - VỈA HÈ - GARA,4,Quận Cầu Giấy,"17,5 ",250,70,nhà ở
Cần bán nhà 2 tầng x 33m2  tại Văn Phú Hà ,2,Quận Hà Đông ,"5,45 ",165,33,nhà ở
"Cần bán nhà 40m2  2,5 tầng mt 3,8 m  đại mạch  anh HN giá 2xxx ",2,Huyện Đông Anh,"2,9 ",73,40,nhà ở
"Cần bán nhà c4 MẶT PHỐ Nguyễn Quyền 55m2 , mặt tiền 4.6m giá 9 ",1,Quận Hoàn Kiếm,9,164,55,nhà ở
"Cần bán nhà chỉ 3,2  tại Đường  Trạch, Thanh Trì, Hà Nội",3,Huyện Thanh Trì,"3,2 ",80,40,nhà ở
"Cần bán nhà chính chủ quận Hoàn Kiếm, Hà Nội.",2,Quận Hoàn Kiếm,"20,6 ",824,25,nhà ở
"CẦN BÁN NHÀ ĐẠI TỪ. DT 45M x 5T. GIÁ 5,5.",3,Quận Hoàng Mai,"5,5 ",122,45,nhà ở
"Cần bán nhà Hoàn Kiếm dt 60m2 mt 5m khu Phúc Tân, Hồng Hà",2,Quận Hoàn Kiếm,12,200,60,nhà ở
"CẦN BÁN NHÀ LINH ĐÀM. NGÕ THÔNG Ô TÔ QUA. DT 44M x 5 T. GIÁ 6,8 ",5,Quận Hoàng Mai,"6,8 ",155,44,nhà ở
Cần bán nhà lô góc 3 mặt thoáng phố Vương Thừa Vũ 40m2 chỉ 8 ,4,Quận Thanh Xuân,8,200,40,nhà ở
"Cần bán nhà mặt phố cổ- 36 phố phường, 203, 2 tầng, giá chỉ 100 ",4,Quận Hoàn Kiếm,100,493,203,nhà ở
"Cần bán nhà mặt phố Nguyễn Quang Bích, dt 345m2, mt 11m, giá 250 ",6,Quận Hoàn Kiếm,250,725,345,nhà ở
CẦN BÁN nhà ngõ thông 2 phố Bạch Đằng và 137 Chương Dương Độ- SĐCC,3,Quận Hoàn Kiếm,"5,5 ",100,55,nhà ở
Cần băn nhà phố An Dương - Xây cực kỳ chắc chắn - Ô tô 20m nhỉnh 7 ,4,Quận Tây Hồ,"7,5 ",170,44,nhà ở
Cần bán nhà Phố Trích Sài nhỉnh 16  Cách Hồ 10m trước nhà thoáng vv,6,Quận Tây Hồ,"16,8 ",373,45,nhà ở
"Cần bán nhà riêng ngõ Trung Yên, Hoàn Kiếm,vị trí đắc địa",3,Quận Hoàn Kiếm,10,556,18,nhà ở
"Cần bán nhà tại thôn Lại Khánh, xã Lại Thượng 100m2",2,Huyện Thạch Thất,"1,9 ",19,100,nhà ở
"Cần bán nhà Tân Khai, Lĩnh , hàng xóm Times Cty, hai thoáng",3,Quận Hoàng Mai,"5,29 ",171,31,nhà ở
Cần bán nhà tập thể phố của bắc,2,Quận Ba Đình,"0,003","0,06",44,chung cư / căn hộ
CẦN BÁN NHÀ THẠCH BÀN LONG BIÊN HÀ NỘI,4,Quận Long Biên,"9,1 ",198,46,nhà ở
CẦN BÁN NHÀ THẠCH BÀN LONG BIÊN HÀ NỘI,3,Quận Long Biên,"4,7 ",152,31,nhà ở
CẦN BÁN NHÀ THẠCH BÀN LONG BIÊN HÀ NỘI,3,Quận Long Biên,"4,7 ",152,31,nhà ở
CẦN BÁN NHÀ THẠCH BÀN LONG BIÊN HÀ NỘI.,4,Quận Long Biên,"9,5 ",198,48,nhà ở
"cần bán phố Tam Khương, 48m2x4,5 T nhà gần phố, vừa ở vừa kd",5,Quận Đống Đa,"7,45 ",149,50,nhà ở
"Cần bán trong tuần căn nhà48m2x4 tầng,MT4m,giá 3,5 Cách đường QL 50M",4,Huyện Quốc Oai,"3,5 ",73,48,nhà ở
Cần bán TT 55m phố Vọng Hà - Hoàn Kiếm,10,Quận Hoàn Kiếm,"2,6 ",47,55,nhà ở
"Căn CCMN Thanh Xuân, ô tô đỗ, thang máy, 2 ngủ, 55m2, full đồ, 1.92 ",2,Quận Thanh Xuân,"1,92 ",35,55,chung cư / căn hộ
Cần chuyển nhượng Villa tại Ba Vì - 720m2 - View hồ - Cạnh sân Golf,6,Thị Xã Sơn Tây,"12,9 ",18,720,nhà ở
"CĂN DIỆN TÍCH RỘNG, Ô TÔ ĐỖ CỬA PHỐ CẦU DIỄN CHỈ NHỈNH 6",3,Quận Bắc Từ Liêm,"6,75 ",123,55,nhà ở
Căn góc penthouse Khai Sơn 4 view sông nhận nhà ở ngay ký  CDT,3,Quận Long Biên,"0,16","0,75",212,chung cư / căn hộ
Căn hộ 65m2. TT Ban cơ yếu chính phủ Nguyễn Chí Thanh,2,Quận Đống Đa,"3,16 ",49,65,chung cư / căn hộ
Căn hộ 65m2. TT Ban cơ yếu chính phủ Nguyễn Chí Thanh,2,Quận Hà Đông ,"3,16 ",49,65,chung cư / căn hộ
"Căn hộ 68m 2,2VS Ecohome 3 (Tòa N5) P. Ngạc",2,Quận Bắc Từ Liêm,"3,9 ",57,68,chung cư / căn hộ
"Căn hộ 88m, 2 ngủ, chung cư Vinaconex 7, gần Vin Gardenia Hàm Nghi.",3,Quận Nam Từ Liêm,"0,006","0,07",88,chung cư / căn hộ
"Căn hộ ccmn 52m, 2 ngủ, Ngã Tư Sở, thoáng sáng",2,Quận Đống Đa,"1,61 ",31,52,chung cư / căn hộ
"Căn hộ ccmn 52m, 2 ngủ, Ngã Tư Sở, thoáng sáng",2,Quận Hà Đông ,"1,61 ",31,52,chung cư / căn hộ
"CĂN HỘ CHO THUÊ KHÉP KÍN FULL NỘI THẤT ĐẸP, Ô TÔ ĐỖ CỬA, LÔ GÓC",9,Quận Bắc Từ Liêm,"8,3 ",119,70,nhà ở
"Căn hộ chung cư ,sang trọng, rộng thoáng,ở sướng",2,Quận Long Biên,"3,9 ",46,85,chung cư / căn hộ
"Căn hộ chung cư 1,35  tại Trần Cung phường Nghĩa Tân Cầu Giấy, 50m2.",2,Quận Cầu  Giấy,"1,35 ",27,50,chung cư / căn hộ
"Căn hộ chung cư 60m2  Trung Yên Cầu Giấy, 2 ngủ 2 wc, 3  9, có sổ",2,Quận Cầu  Giấy,"3,9 ",65,60,chung cư / căn hộ
Căn hộ chung cư 70m,3,Quận Long Biên,"3,2 ",46,70,chung cư / căn hộ
"Căn hộ chung cư KĐT Việt Hưn, 77m2, 2 ngủ, 2 wc tài chính dưới 3 ",2,Quận Long Biên,"2,62 ",34,77,chung cư / căn hộ
Căn hộ Giảng Võ – Biểu tượng của phong cách sống đỉnh cao! sổ đỏ,2,Quận Ba Đình,"4,38 ",63,70,chung cư / căn hộ
Căn hộ greenhouse 83m2 -2N2WC- CT17 Việt Hưng,2,Quận Long Biên,"3,5 ",42,83,chung cư / căn hộ
CĂN HỘ LUXURY VIEW PHỐ ĐẠI LA - 3 2WC - ĐẦY ĐỦ CÔNG NĂNG,3,Quận Hai Bà Trưng,"4,3 ",48,90,chung cư / căn hộ
"CĂN HỘ N09B1 KĐT DỊCH VỌNG 119M2 8.38 , LÔ GÓC, FULL NỘI THẤT Ở NGAY",3,Quận Cầu  Giấy,"8,38 ",70,119,chung cư / căn hộ
CĂN HỘ STUDIO ĐỐNG ĐA - FULL NỘI THẤT - AN SINH TỐT - GẦN HỒ - GẦN PHỐ,1,Quận Đống Đa,"1,45 ",36,40,chung cư / căn hộ
CĂN HỘ STUDIO ĐỐNG ĐA - FULL NỘI THẤT - AN SINH TỐT - GẦN HỒ - GẦN PHỐ,1,Quận Hà Đông ,"1,45 ",36,40,chung cư / căn hộ
"Căn hộ tại Thành Công Tower 57 Láng Hạ, 193m2, 3, pháp lý đầy đủ",3,Quận Ba Đình,"14,3 ",74,193,chung cư / căn hộ
"Căn hộ tập thể Mặt phố Nguyễn Văn Huyên, 48m2, góc, 2, đang cho thuê",10,Quận Cầu  Giấy,4,83,48,chung cư / căn hộ
"Cán hộ tập thể tầng 1 phố bạch mai, 68m , 2 ngủ , giá 3,55  sổ 43m",2,Quận Hai Bà Trưng,"3,55 ",52,68,chung cư / căn hộ
Căn hộ thuộc toà dự án Lilama 124 Minh Khai.  Dt: 113m giá 6.5 .,2,Quận Hai Bà Trưng,"6,5 ",58,113,chung cư / căn hộ
"Căn hộ tòa N2, Hoàng Minh Giám. Sđ 54m, 2N-1VS, full nt, nhà ở rất lộc",3,Quận Cầu  Giấy,"3,45 ",64,54,chung cư / căn hộ
"CĂN LÔ GÓC 6 TẦNG, THANG MÁY, NGÕ THÔNG KINH DOANH ĐẸP",4,Quận Long Biên,"15,2 ",292,52,nhà ở
"Căn nhà siêu đẹp ở gần chợ Hà , nội thất toàn gỗ, 38m2, hơn 8 ",4,Quận Hà Đông ,"8,8 ",232,38,nhà ở
"cần tiền bán gấp cc sài đồng nhà mới đẹp đủ đồ , tầng cao thoáng mát",2,Quận Long Biên,"2,9 ",41,70,chung cư / căn hộ
Cần tiền bán gấp nhà chia lô phố Hoàng Hoa Thám,6,Quận Ba Đình,"14,6 ",195,75,nhà ở
Cần Tiền Cho Con Đi Du Học Bán Cắt Lỗ Nhà 5 Tầng 34m2 Ngay Gần QL6,3,Huyện Chương Mỹ,"2,35 ",67,35,nhà ở
"Cần tiền gấp , chủ gửi bán nhà Trương Định , 44m2 , 6  ,Sổ vuông đẹp",3,Quận Hai Bà Trưng,6,136,44,nhà ở
Cần tiền nên bán nhà gấp,3,Huyện Quốc Oai,"3,25 ",79,41,nhà ở
"CẢNH BÁO, siêu phẩm Võ Chí Công, gần ô tô 2 thoáng , ngõ to rộng",3,Quận Cầu Giấy,"6,3 ",197,32,nhà ở
CẠNH ĐẠI HỌC TD-TT HÀ NỘI BÁN GẤP CĂN NHÀ 3.5 TẦNG GIÁ 2.78  50m2,3,Huyện Chương Mỹ,"2,8 ",56,50,nhà ở
Cắt Lỗ 1.5  Bán Chung Cư Sunshine City Bắc Từ Liêm 103m 3 ngủ Lô Góc,3,Quận Bắc Từ Liêm,"7,5 ",73,103,chung cư / căn hộ
CẮT LỖ_CHUNG CƯ H1 ĐẠI CỒ VIỆT_TRẦN KHÁT CHÂN_HAI BÀ TRƯNG,2,Quận Hai Bà Trưng,"0,766",14,55,chung cư / căn hộ
"CC bán CHCC N07 Trần Đăng Ninh , 80m2 lô góc 2, 2VS , 2BC",2,Quận Cầu  Giấy,"4,96 ",62,80,chung cư / căn hộ
"CC Bán Nhà Mặt Phố Quang Trung, TX Sơn Tây",2,Thị Xã Sơn Tây,"11,99 ",100,120,nhà ở
CC bán nhà phố đình quán quận bắc từ liêm,3,Quận Bắc Từ Liêm,"5,75 ",174,33,nhà ở
"CC BÁN NHÀ VƯỜN NHƯ HÌNH, SÁT SÂN BAY NỘI BÀI, Ô TÔ TRONG NHÀ",2,Huyện Sóc Sơn,15,21,700,nhà ở
"CC Cần Bán Căn 2-70m2-Full NT, TP Giao Lưu Phạm Văn Đồng, Giá 4.x ",2,Quận Bắc Từ Liêm,"4,55 ",65,70,chung cư / căn hộ
CC cần bán nhà ( Ko qua môi giới ) Mới xây kính koong 5 tầng.,3,Huyện Thanh Oai,"3,65 ",112,33,nhà ở
"CC cần bán nhà 4 tầng 2 thoáng trước sau giáp KĐT Đô Nghĩa, giá đầu tư",4,Quận Hà Đông ,"4,6 ",118,39,nhà ở
CC chuyển nhượng Thiên đường nghỉ dưỡng Villa Sóc Sơn nhỉnh 12 .,6,Huyện Sóc Sơn,"12,5 ",10,1200,nhà ở
"CC gửi bán nhà tại Đoàn Thị Điểm, Đống Đa 50M, mới đẹp, ở ngay.",4,Quận Đống Đa,"8,8 ",187,47,nhà ở
CCMN HÀO  - DÒNG TIỀN ỔN ĐỊNH CẦN BÁN,10,Quận Đống Đa,"9,5 ",164,58,chung cư / căn hộ
CCMN HÀO  - DÒNG TIỀN ỔN ĐỊNH CẦN BÁN,10,Quận Hà Đông ,"9,5 ",164,58,chung cư / căn hộ
CCMN Nguyễn Trãi HÀNG XÓM ROYAL Ô TÔ ĐỖ CHÂN TOÀ  55m giá 2.05 (CTL),2,Quận Thanh Xuân,"2,05 ",37,55,chung cư / căn hộ
CCMN tầng 1 phố Vân Hồ 3 - Nguyễn Đình Chiểu cách oto 20m ngõ 3m,2,Quận Hai Bà Trưng,"2,5 ",33,75,chung cư / căn hộ
CCMN- THANH XUÂN- NGUYỄN TRÃI- DÒNG TIỀN TỐT- GIÁ MỀM,9,Quận Thanh Xuân,"8,25 ",206,40,nhà ở
"CCMN Yên Xá 7t thang máy 11P, 41m mt4,2m,ngõ thông,Nông,Rộng 10m ô tô",10,Huyện Thanh Trì,"8,45 ",206,41,nhà ở
"CH 3 75m2 nội thất cao cấp, giá tốt, sẵn sổ, ban công  ",3,Quận Nam Từ Liêm,"4,65 ",62,75,chung cư / căn hộ
"CHDV Chùa Láng, Nhà Đẹp, 41m*6T*9p KK, 5 Tạ Đỗ Cửa, Ngõ Thoáng, SDCC",9,Quận Đống Đa,"8,19 ",200,41,nhà ở
CHỈ 1 650TR SỞ HỮU CĂN 2 NGỦ NGÕ 603 LẠC LONG QUÂN-KHU LIÊN CƠTÂY HỒ,2,Quận Tây Hồ,"1,65 ",32,52,nhà ở
Chỉ 14.9  CÓ NGAY NHÀ HOÀNG QUỐC VIỆT - 54.5m2 x 6TẦNG - THANG MÁY,4,Quận Cầu Giấy,"14,9 ",273,55,nhà ở
CHỈ 2  SỞ HỮU CĂN HỘ 70 M CCMN MẶT PHỐ THƯỢNG ĐÌNH 2 NGỦ 2VS ĐẸP,2,Quận Thanh Xuân,"2,05 ",29,70,chung cư / căn hộ
"Chỉ 2.235  có nhà ô tô đỗ cửa cách cầu Mai Lĩnh 4km, view thoáng mát",3,Huyện Thanh Oai,"2,235",64,35,nhà ở
"Chỉ 20m Ra Đường oto Tránh - Gần Trường Học,Chợ,100m Ra Đường Liên Xã",3,Huyện Chương Mỹ,"2,7 ",77,35,nhà ở
CHỈ 22  75m2 TRẦN QUỐC HOÀN CẦU GIẤY PHÂN LÔ Ô TÔ TRÁNH KINH DOANH,6,Quận Cầu Giấy,22,293,75,nhà ở
CHỈ 22  75m2 TRẦN QUỐC HOÀN CẦU GIẤY PHÂN LÔ Ô TÔ TRÁNH KINH DOANH,6,Quận Cầu Giấy,22,293,75,nhà ở
CHỈ 3.x  - HỘ KHẨU HOÀN KIẾM - LÔ GÓC 3 MẶT THOÁNG - Ô TÔ ĐỖ - TẶNG,2,Quận Hoàn Kiếm,"3,5 ",44,80,chung cư / căn hộ
CHỈ 3.x  - HỘ KHẨU HOÀN KIẾM - LÔ GÓC 3 MẶT THOÁNG - Ô TÔ ĐỖ - TẶNG,2,Quận Hoàng Mai,"3,5 ",44,80,chung cư / căn hộ
CHỈ 5  CÓ NGAY CĂN 3 NGỦ HỘ KHẨU CẦU GIẤY - VỀ Ở NGAY - GIÁ GIA LỘC,3,Quận Cầu  Giấy,5,71,70,chung cư / căn hộ
Chỉ 5.5 Có Ngay - Nhà Mới - Ngọc Trục - Đại Mỗ -  Từ Liêm - 3,3,Quận Nam Từ Liêm,"5,6 ",170,33,nhà ở
CHỈ 6X  Ở NGAY NHÀ ĐẸP TRẦN CUNG - CHỦ TẶNG FULL NỘI THẤT - GẦN Ô TÔ,3,Quận Bắc Từ Liêm,"6,35 ",212,30,nhà ở
"CHỊ GÁI GỬI BÁN NHÀ MỚI  Đội Cấn 33m 5 tầng mt 3,6m chỉ 7.25  CTL",3,Quận Ba Đình,"7,25 ",220,33,nhà ở
Chị Hà. Chủ nhà Cần Bán Căn Ruby3 Phúc Lợi 45m2. 2 siêu đẹp,2,Quận Long Biên,"2,15 ",48,45,chung cư / căn hộ
Chỉ nhỉnh 2  Nhà 25m gần phố 2 thoáng trước sau đầy đủ nội thất,2,Quận Ba Đình,"2,9 ",116,25,nhà ở
"Chỉ từ 193 có ngay nhà 3tầng, ra ngay đường ô tô tránh",3,Huyện Thanh Oai,"1,93 ",57,34,nhà ở
"CHỈ VÀI BƯƠC CHÂN TỚI TRƯỜNG HỌC,UBND,CHỢ NHÀ ÔTÔ ĐỖ SÂN CHỈ NHỈNH 3TY",4,Huyện Quốc Oai,"3,1 ",48,64,nhà ở
"Chỉ với 2,55  đã sở hữu căn 37m2 sát Hà  Ô tô đỗ cửa",3,Huyện Thanh Oai,"2,55 ",69,37,nhà ở
"CHỈ VỚI HƠN 200TR/M SỞ HỮU NHÀ SIÊU ĐẸP LÊ ĐỨC THỌ, OTO VÀO NHÀ, KINH",5,Quận Nam Từ Liêm,"12,6 ",263,48,nhà ở
CHIẾT KHẤU CAO! CC QUAN NHÂN - ROYAL - Ô TÔ ĐỖ,2,Quận Thanh Xuân,"0,78",15,52,chung cư / căn hộ
Chính chủ - bán chung cư N02 Phạm Ngọc Thạch- Xã Đàn-từ 600tr,2,Quận Đống Đa,"1,2 ",22,55,chung cư / căn hộ
Chính chủ - bán chung cư N02 Phạm Ngọc Thạch- Xã Đàn-từ 600tr,2,Quận Hà Đông ,"1,2 ",22,55,chung cư / căn hộ
Chính Chủ - Bán Gấp căn hộ L2 XUÂN LA - LẠC LONG QUÂN - Full Đồ 1-2,2,Quận Tây Hồ,"0,95",18,53,chung cư / căn hộ
chính chủ bán,4,Quận Ba Đình,12,678,18,nhà ở
Chính chủ bán biệt thự 3 tầng 165m2 Thường Tín hn,4,Huyện Thường Tín,"8,25 ",50,165,nhà ở
Chính chủ bán căn 22vs toà SA3 dự án Vinhomes Smart City,2,Quận Nam Từ Liêm,"3,85 ",71,54,chung cư / căn hộ
Chính chủ bán căn 40m2- Phạm Văn Đồng- xuân Đỉnh- Công Viên Hoà Bình,1,Quận Bắc Từ Liêm,"0,98",25,40,chung cư / căn hộ
Chính chủ bán căn 78m 2 ngủ 2 wc tầng 21 Goldmark city,2,Quận Bắc Từ Liêm,"5,15 ",66,78,chung cư / căn hộ
"Chính chủ bán CĂN GÓC KĐT VIỆT HƯNG_Q.LONG BIÊN:90m2_3,2WC_ 3,8 ",3,Quận Long Biên,"3,829",43,90,chung cư / căn hộ
"Chính chủ bán căn hộ 85m2 tại Xuân Đỉnh, quận Bắc Từ Liêm",2,Quận Bắc Từ Liêm,"3,8 ",45,85,chung cư / căn hộ
"Chính chủ bán căn hộ chung cư 22wc tại Iris Garden ,cam kết không ảo",2,Quận Nam Từ Liêm,"4,5 ",73,62,chung cư / căn hộ
Chính chủ bán căn nhà 4 tầng 41m Mỹ Đình mặt ngõ 3 gác tránh 8.5  TL,4,Quận Nam Từ Liêm,"8,5 ",207,41,nhà ở
Chính chủ Bán căn Shophouse  KHU ĐÔ THỊ MỚI KIM TRUNG - DI TRẠCH .,6,Quận Nam Từ Liêm,50,266,188,nhà ở
"Chính chủ bán căn tập thể Trung Tự 72m - 02 ngủ + wc+ khách, bếp.",2,Quận Đống Đa,"3,1 ",43,72,chung cư / căn hộ
"Chính chủ bán căn tập thể Trung Tự 72m - 02 ngủ + wc+ khách, bếp.",2,Quận Hà Đông ,"3,1 ",43,72,chung cư / căn hộ
Chính Chủ Bán căn TT Phố Núi Trúc - Ba Đình - 50m2 - 2 - 2.47,2,Quận Ba Đình,"2,47 ",49,50,chung cư / căn hộ
Chính chủ bán CC An Trạch - Cát Linh - Đống Đa,2,Quận Đống Đa,"1,96 ",39,50,chung cư / căn hộ
Chính chủ bán CC An Trạch - Cát Linh - Đống Đa,2,Quận Hà Đông ,"1,96 ",39,50,chung cư / căn hộ
CHÍNH CHỦ BÁN CHUNG CƯ H2 THÁI HÀ - CHÙA BỘC 1-2P NGỦ FULL ĐỒ - Ở NGAY,2,Quận Đống Đa,"0,975",18,53,chung cư / căn hộ
CHÍNH CHỦ BÁN CHUNG CƯ H2 THÁI HÀ - CHÙA BỘC 1-2P NGỦ FULL ĐỒ - Ở NGAY,2,Quận Hà Đông ,"0,975",18,53,chung cư / căn hộ
Chính chủ bán gấp căn góc 2 ngủ trục hoa hậu giá rẻ nhất Goldmark City,2,Quận Bắc Từ Liêm,"5,2 ",60,86,chung cư / căn hộ
Chính chủ BÁN GẤP căn hộ Green Iconic 110m2,3,Quận Long Biên,"8,25 ",75,110,chung cư / căn hộ
"Chính chủ Bán gấp nhà 36,5m2 x 3 tầng ôtô đỗ cửa  La Hoài Đức",3,Huyện Hoài Đức,"3,6 ",99,36,nhà ở
Chính Chủ bán gấp nhà 4T Đồng Nhân  giá  2ty88-OtÔ Cạnh nhà -sổ riêng,4,Huyện Hoài Đức,"2,88 ",93,31,nhà ở
CHÍNH CHỦ BÁN GẤP NHÀ CẤP 4-ÔTÔ-52M2-5 580TR-NHẬT TẢO-AN DƯƠNG VƯƠNG,2,Quận Bắc Từ Liêm,"5,58 ",107,52,nhà ở
CHÍNH CHỦ BÁN GẤP NHÀ MẶT PHỐ CỔ ĐIỂN A,3,Huyện Thanh Trì,"8,5 ",243,35,nhà ở
"Chính chủ bán liền kề B14 - 1x, trục chính dự án Cienco 5 Tân Lập",5,Huyện Đan Phượng,7,100,70,nhà ở
"CHÍNH CHỦ BÁN NHÀ 300 PHỐ  DƯ HOÀNG MAI,DT31M2 XÂY 5 TẦNG,MT4,1M",3,Quận Hoàng Mai,"5,13 ",160,32,nhà ở
"CHÍNH CHỦ BÁN NHÀ 4 TẦNG - TÂN MAI - DT 22m/ MT 3,25m - 2,65 ",3,Quận Hoàng Mai,"2,65 ",120,22,nhà ở
Chính chủ bán nhà 4 tầng chợ bích hoà,4,Huyện Thanh Oai,"4,2 ",118,36,nhà ở
"chính chủ bán nhà 40m2 x 4 tầng ,full nội thất ngõ 206 cổ linh",3,Quận Long Biên,"6,25 ",156,40,nhà ở
CHÍNH CHỦ BÁN NHÀ CĂN GÓC LIỀN KỀ 26M MẶT TIỀN KĐT GELEXIMCO HÀ ,4,Quận Hà Đông ,42,292,144,nhà ở
CHÍNH CHỦ BÁN NHÀ CẦU ĐẤT - HOÀN KIẾM,3,Quận Hoàn Kiếm,"3,62 ",213,17,nhà ở
Chính chủ bán nhà Cầu Giấy 55m 10  ngõ ba gác,7,Quận Cầu Giấy,10,185,54,nhà ở
"CHÍNH CHỦ BÁN NHÀ ĐẠI ÁNG, THANH TRÌ - 3 TẦNG - KINH DOANH",3,Huyện Thanh Trì,"6,2 ",84,74,nhà ở
"CHÍNH CHỦ BÁN NHÀ ĐẠI TỪ - LINH ĐÀM. DT 42M x 5T. GIÁ 6,6 .",6,Quận Hoàng Mai,"6,6 ",157,42,nhà ở
Chính chủ bán Nhà đẹp đón tết Mỹ Đình 54m 5T Ngõ 3m an ninh tốt.,5,Quận Nam Từ Liêm,"6,45 ",119,54,nhà ở
Chính chủ Bán nhà dịch vọng 40/42m* 5 tầng-Ô Tô đỗ,4,Quận Cầu Giấy,"10,5 ",263,40,nhà ở
Chính chủ Bán nhà Hiếm Nhà Bán phố Hai Bà Trưng,2,Quận Hoàn Kiếm,"6,35 ",397,16,nhà ở
"CHÍNH CHỦ BÁN NHÀ KHƯƠNG ĐÌNH 47M2*5 TẦNG, 6 NGỦ GIÁ 7,1",6,Quận Thanh Xuân,"7,1 ",151,47,nhà ở
"CHÍNH CHỦ BÁN NHÀ LÔ GÓC 40M TỔ 13 YÊN NGHĨA, HÀ  FULL NỘI THẤT",5,Quận Hà Đông ,"4,95 ",124,40,nhà ở
"Chính Chủ bán nhà lô góc Phố Thái Thịnh, dân xây kiên cố, sẵn ở",3,Quận Đống Đa,"4,7 ",270,17,nhà ở
Chính chủ bán nhà mặt ngõ 113 Nguyễn An Ninh,3,Quận Hoàng Mai,"10,85 ",195,56,nhà ở
CHÍNH CHỦ BÁN NHÀ MỚI ĐÓN TẾT- NHÀ GIÁP PHỐ TÔN ĐỨC THẮNG- KINH DOANH,3,Quận Đống Đa,"7,686",240,32,nhà ở
CHÍNH CHỦ BÁN NHÀ MỚI ĐÓN TẾT- NHÀ GIÁP PHỐ TÔN ĐỨC THẮNG- KINH DOANH,3,Quận Đống Đa,"7,686",240,32,nhà ở
CHÍNH CHỦ BÁN NHÀ MỚI ĐÓN TẾT- NHÀ GIÁP PHỐ TÔN ĐỨC THẮNG- KINH DOANH,3,Quận Đống Đa,"7,686",240,32,nhà ở
"Chính Chủ Bán nhà Ngã Tư Sơn Đồng, Hoài Đức, Hà Nội",2,Huyện Hoài Đức,"1,75 ",78,23,nhà ở
"Chính chủ bán nhà ngõ 230 Định Công Thượng, 3 tầng 2 ngủ chỉ 1.7 ",2,Quận Hoàng Mai,"1,7 ",68,25,nhà ở
"Chính chủ bán nhà ngõ 42 Sài Đồng DT 45.8m2, 4,5 tầng giá 6.5 ",3,Quận Long Biên,"6,5 ",142,46,nhà ở
"Chính chủ bán nhà Ngọc Thuỵ. 45m2, 2 thoáng, Ôtô tránh, Giá 7.45 ",5,Quận Long Biên,"7,45 ",166,45,nhà ở
Chính chủ bán nhà phố cự lộc.2 mặt thoáng.30m ra MP nguyễn trãi (MTG),4,Quận Thanh Xuân,"5,8 ",153,38,nhà ở
chính chủ bán nhà phố dịch vọng nhà 4T cũ khung cột chắc chắn có thể,7,Quận Cầu Giấy,"13,5 ",175,77,nhà ở
CHÍNH chủ bán nhà phố NGUYỄN CHÁNH TRẦN DUY HƯNG phân Lô đường rộng 8m,6,Quận Cầu Giấy,"23,89 ",398,60,nhà ở
"CHÍNH CHỦ BÁN NHÀ PHƯƠNG CANH, DT 38M2 X 5 TẦNG.",6,Quận Nam Từ Liêm,"5,9 ",155,38,nhà ở
Chính chủ bán nhà riêng Hoàn Kiếm 43m,2,Quận Hoàn Kiếm,5,116,43,nhà ở
Chính chủ bán nhà SÂN VƯỜN phố NGỌC KHÁNH 40m ra ôtô tránh  4T 72m2 SD,4,Quận Ba Đình,"8,5 ",129,66,nhà ở
"Chính chủ bán nhà tầng 1 Bạch mai sổ 28 TT 60m giá 2.9 tỉ, ô tô đỗ cửa",2,Quận Hai Bà Trưng,"2,9 ",104,28,nhà ở
CHÍNH CHỦ BÁN NHÀ THANH AM THƯỢNG THANH 32m2 x MT 3.88m x 4 tầng,4,Quận Long Biên,"4,6 ",144,32,nhà ở
"Chính chủ bán nhà Tô Vĩnh Diện, 30m ra phố, ngõ 3m",6,Quận Thanh Xuân,"9,15 ",229,40,nhà ở
"Chính Chủ Bán Nhà Trích Sài ,Tây Hồ , Ô Tô ,Kinh Doanh , Mặt Hồ Hiếm N",3,Quận Tây Hồ,17,378,45,nhà ở
"Chính chủ bán nhà Vân Côn, Hoài Đức, Hà Nội 43m2x3 tầng full nội thất.",3,Huyện Hoài Đức,"2,95 ",69,43,nhà ở
"CHÍNH CHỦ BÁN NHÀ XÃ KHÁNH HÀ, THƯỜNG TÍN -3 TẦNG",3,Huyện Thường Tín,"3,6 ",73,49,nhà ở
chính chủ bán nhà xây đơn lập tại Trôi - Hoài Đức - ô tô vào,3,Huyện Đan Phượng,"4,7 ",138,34,nhà ở
"Chính chủ bán toà nhà mặt phố Cao Bá Quát, DT 420.5m2, MT 15m, xây 6 t",8,Quận Ba Đình,470,1119,420,nhà ở
