Tiêu đề,Số phòng ,Vị trí,Giá ,Giá / Diện tích,Diện tích,Loại hình
"NHÀ ĐẦU PHỐ NGUYỄN VĂN CỪ, LONG BIÊN, DT 90M x 3T - MT 6M, GIÁ 17.5 ",4,Quận Long Biên,"17,5 ",194,90,nhà ở
"NHÀ ĐẦU PHỐ PHÚC TÂN, QUẬN HOÀN KIẾN NHỈNH 2 , NHÀ 3 TẦNG / 2 THOÁNG",2,Quận Hoàn Kiếm,"2,5 ",114,22,nhà ở
NHÀ ĐẸP – 50M RA PHỐ – FULL NỘI THẤT Ở NGAY – ĐẠI LA HAI BÀ TRƯNG,3,Quận Hai Bà Trưng,"2,15 ",134,16,nhà ở
"NHÀ ĐẸP - ĐÓN TẾT - ĐỒNG NHÂN,  LA - 3 TẦNG - 30 M2",3,Huyện Hoài Đức,"3,5 ",117,30,nhà ở
NHÀ ĐẸP - FULL ĐỒ - KHÁCH CHỈ VIỆC XÁCH VALY VỀ Ở - NGAY GẦN HỒ AO LÃO,3,Quận Long Biên,"5,65 ",157,36,nhà ở
"NHÀ ĐẸP - Ở NGAY - Ô TÔ QUA CỬA -  GẦN CHỢ - ĐỘ CHÀNG, QUỐC OAI - 48M2",4,Huyện Quốc Oai,"3,05 ",64,48,nhà ở
NHÀ ĐẸP – Ô TÔ ĐỖ CỬA  - HAI THOÁNG VƯỢNG KHÍ – HỒNG MAI,2,Quận Hai Bà Trưng,"5,8 ",153,38,nhà ở
Nhà Đẹp ! Nhân Chính - Lô góc 3 thoáng siêu rộng -ở sướng kdoanh,5,Quận Thanh Xuân,"9,89 ",215,46,nhà ở
NHÀ ĐẸP 3 TẦNG GIÁa RẺ XÓM  LƯƠNG NỖ TIÊN DƯƠNG,3,Huyện Đông Anh,"4,4 ",73,60,nhà ở
Nhà Đẹp 36 Trung Tâm Nguyễn Xiển – Giá Siêu Hấp Dẫn Chỉ 1.8 ,2,Quận Thanh Xuân,"1,8 ",50,36,nhà ở
NHÀ ĐẸP 4 TẦNG - NHỈNH 1  - SỔ ĐỎ RIÊNG - LÔ GÓC,2,Quận Hoàng Mai,"1,7 ",142,12,nhà ở
Nhà đẹp 5 tầng 3 ngủ ở Tả Thanh Oai,3,Huyện Thanh Trì,"3,5 ",117,30,nhà ở
Nhà Đẹp 5 Tầng Kim Giang - Kinh Doanh Tốt - Full Nội Thất Cao Cấp 🏡,4,Quận Hoàng Mai,6,171,35,nhà ở
Nhà Đẹp 5 Tầng Quan Nhân - 7 Ngủ - Gần Hồ.,7,Quận Thanh Xuân,"7,65 ",191,40,nhà ở
Nhà đẹp 60m x 6T thang máy cạnh trường cấp 3 Thạch Bàn xe 7 chỗ vào,5,Quận Long Biên,11,183,60,nhà ở
"Nhà đẹp Cầu Diễn, Bắc Từ Liêm, HN 6 tầng mặt tiền 4,7m diện tích 63m2",8,Quận Bắc Từ Liêm,"13,95 ",221,63,nhà ở
"NHÀ ĐẸP CẦU GIẤY 45M NGÕ NÔNG ,FULL NỘI THẤT,SỔ ĐẸP NỞ HẬU",3,Quận Cầu Giấy,7,156,45,nhà ở
"NHÀ ĐẸP CẦU GIẤY 45M,NGÕ NÔNG, BA GÁC, FULL NỘI THẤT,SỔ ĐẸP",3,Quận Cầu Giấy,7,156,45,nhà ở
NHÀ ĐẸP ĐÌNH QUÁN - VĂN TIẾN DŨNG  MỚI FULL NỘI THẤT GẦN Ô TÔ GẦN PHỐ,3,Quận Bắc Từ Liêm,"5,7 ",163,35,nhà ở
NHÀ ĐẸP ĐÓN TẾT - TT TẦNG 3 - 65m - Nhỉnh 3 ,2,Quận Đống Đa,"3,18 ",49,65,chung cư / căn hộ
NHÀ ĐẸP ĐÓN TẾT - TT TẦNG 3 - 65m - Nhỉnh 3 ,2,Quận Hà Đông ,"3,18 ",49,65,chung cư / căn hộ
NHÀ ĐẸP ĐÓN TẾT . NGUYỄN NGỌC NẠI 53m / 4 tầng / mt 4.7 .,5,Quận Thanh Xuân,"11,6 ",219,53,nhà ở
"Nhà đẹp đón Tết, Lò Đúc, trung tâm HBT, sổ chính chủ nở hậu bán 6880",4,Quận Hai Bà Trưng,"6,88 ",181,38,nhà ở
"Nhà đẹp Full nội thất Tân Mai ngõ rộng, đi 3 bước chân ra chợ",4,Quận Hoàng Mai,"2,55 ",142,18,nhà ở
NHÀ ĐẸP GẦN CHỢ MAI HIÊN - MAI LÂM -  ANH,3,Huyện Đông Anh,"3,3 ",56,59,nhà ở
"NHÀ ĐẸP GIÁ LẠI CÒN ĐẸP HƠN NHÀ   LA36M2X 5TẦNG CHỈ 3,XTY NGÕ ÔTÔ",4,Huyện Hoài Đức,3,83,36,nhà ở
"Nhà đep giá rẻ, tại phụng châu 3T- DT 37m2, ô tô đỗ cửa, Giá chỉ 255",3,Huyện Chương Mỹ,"2,55 ",69,37,nhà ở
NHÀ ĐẸP GIÁ TỐT,5,Huyện Phúc Thọ,"6,7 ",67,100,nhà ở
NHÀ ĐẸP HAI BÀ TRƯNG - LÔ GÓC - MẶT PHỐ - FULL NỘI THẤT - 3 RIÊNG,3,Quận Hai Bà Trưng,"4,68 ",39,120,chung cư / căn hộ
"NHÀ ĐẸP HIẾM CÓ-GẦN PHỐ-DÂN XÂY 6 TẦNG, ĐỦ CÔNG NĂNG -ĐẸP LONG LANH",3,Quận Bắc Từ Liêm,"6,95 ",188,37,nhà ở
"Nhà đẹp Hoài Đức dân xây,căn độc lập, đường oto vào nhà",5,Huyện Hoài Đức,"3,85 ",79,49,nhà ở
NHÀ ĐẸP HOÀN KIẾM - THIẾT KẾ HIỆN ĐẠI - NGÕ NÔNG SÁT PHỐ - FULL NỘI TH,3,Quận Hoàn Kiếm,"10,2 ",268,38,nhà ở
Nhà Đẹp Hoàng Hoa Thám- TT Ba Đình - Siêu rẻ - Full nội thất.,3,Quận Ba Đình,6,200,30,nhà ở
NHÀ ĐẸP KHÔNG LO NGHĨ Ở SƯỚNG VÀI THẾ HỆ .....,5,Quận Đống Đa,"8,88 ",118,75,nhà ở
Nhà đẹp khu  xã đàn,6,Quận Đống Đa,"10,3 ",224,46,nhà ở
NHÀ ĐẸP KHU ĐÔ THỊ TRUNG HOÀ NHÂN CHÍNH - FULL NỘI THẤT - VIEM MẶT PHỐ,3,Quận Thanh Xuân,"4,97 ",50,100,chung cư / căn hộ
"NHÀ ĐẸP KHƯƠNG HẠ, GẦN HỒ ĐIỀU HÒA, KINH DOANH, DT80M2 5T 9N4W HƠN 7",9,Quận Thanh Xuân,"7,8 ",98,80,nhà ở
"Nhà đẹp Kim Giang  50m2 , oto đỗ cửa, nội thất sang trọng",3,Huyện Thanh Trì,9,180,50,nhà ở
"Nhà đẹp Kim Giang dân xây 6 ngủ, ngõ đẹp ô tô gần, sổ vuông",6,Quận Thanh Xuân,"5,3 ",177,30,nhà ở
"NHÀ ĐẸP LÒ ĐÚC,HAI BÀ TRƯNG, 44m,3T,VÀI BƯỚC LÊN BỜ HỒ. NGÕ RỘNG,6,88t",3,Quận Hai Bà Trưng,"6,88 ",156,44,nhà ở
"NHÀ ĐẸP LONG LANH ĐÓN TẾT 2025 XUÂN CANH,  ANH - VIEW ĐẸP",4,Huyện Đông Anh,"3,4 ",65,52,nhà ở
"Nhà đẹp Minh Khai, Hai Bà Trưng, 34m, 4t, Ngõ rộng, gần phố, 6,15ty",5,Quận Hai Bà Trưng,"6,15 ",181,34,nhà ở
Nhà Đẹp Ngõ 460 Thụy Khuê – Không Gian Sống Đầy Cảm Hứng,3,Quận Tây Hồ,"7,2 ",240,30,nhà ở
"NHÀ ĐẸP NHẤT TRONG TẦM TIỀN 7.5  TẠI QUAN HOA, CÁCH PHỐ ĐÚNG 1 NHÀ",5,Quận Cầu Giấy,"7,5 ",234,32,nhà ở
NHÀ ĐẸP Ở LUÔN - 2 MẶT THOÁNG - TẶNG FULL NỘI THẤT - 3 PHÒNG NGỦ 2WC,3,Quận Thanh Xuân,"2,68 ",34,80,chung cư / căn hộ
"Nhà đẹp ở luôn Quang Tiến gần oto, hàng xóm Vin, 35m 4T giá 5.68",4,Quận Nam Từ Liêm,"5,68 ",162,35,nhà ở
"NHÀ ĐẸP Ở NGAY - THOÁNG TRƯỚC SAU, 20M RA Ô TÔ,",4,Quận Bắc Từ Liêm,5,111,45,nhà ở
"Nhà đẹp ở ngay,gần Chợ,gần ô tô Triều Khúc 33m2, 5 tầng. Giá 5.6 .",3,Quận Thanh Xuân,"5,6 ",170,33,nhà ở
"Nhà đẹp ở ngay,lô góc,ngõ thông Triều khúc 36, 5 tầng. Giá 6.5 .",3,Quận Thanh Xuân,"6,5 ",181,36,nhà ở
"NHÀ ĐẸP Ô TÔ VÀO NHÀ PHỐ AN DƯƠNG- TÂY HỒ 38M2, 6 TẦNG,12.5 .",4,Quận Tây Hồ,"12,5 ",329,38,nhà ở
Nhà Đẹp OTO Đỗ Cửa - 5p Ra KĐT Đô Nghĩa Bệnh Viện Phi,3,Huyện Quốc Oai,"3,3 ",73,45,nhà ở
NHÀ ĐẸP PHÂN LÔ - THANG MÁY - Ô TÔ TRÁNH,3,Quận Cầu Giấy,"15,5 ",310,50,nhà ở
Nhà đẹp phố Bùi Xương Trạch nhà lô góc 6 tầng,5,Quận Thanh Xuân,"8,3 ",277,30,nhà ở
Nhà đẹp phố phố Giải phóng- Phan đình giót.,3,Quận Thanh Xuân,"4,85 ",143,34,nhà ở
NHÀ ĐẸP PHỐ PHÚ MỸ- MỸ ĐÌNH2- NGÕ NÔNG Ô TÔ - ĐẸP HOA HẬU- DÂN XÂY CHẮ,4,Quận Nam Từ Liêm,"7,3 ",183,40,nhà ở
Nhà đẹp phố Quan Nhân,7,Quận Thanh Xuân,"7,65 ",213,36,nhà ở
"NHÀ ĐẸP PHỐ TRẦN KHÁT CHÂN,HAI BÀ TRƯNG - FULL NỘI THẤT -SANG TRỌNG",3,Quận Hai Bà Trưng,"6,5 ",217,30,nhà ở
"Nhà đẹp Phố Vọng,Q.Hai Bà Trưng, KD tại nhà, dt 25m x5T, 4.95 ",3,Quận Hai Bà Trưng,"4,95 ",198,25,nhà ở
"Nhà Đẹp Phụng Châu - Gần Trường TDTT  - 5p Ra QL6,Bến Xe Yên Nghĩa",3,Huyện Chương Mỹ,"2,27 ",69,33,nhà ở
Nhà đẹp quận Hoàng Mai,3,Quận Hoàng Mai,"4,88 ",148,33,nhà ở
Nhà đẹp quận Thanh Xuân,4,Quận Thanh Xuân,"7,412",169,44,nhà ở
"Nhà đẹp Quang Trung, Yên Nghĩa gần bến xe, gần tàu điện",4,Quận Hà Đông ,"4,95 ",124,40,nhà ở
"Nhà đẹp sổ riêng 4,5T Ngõ nông -Ô tô cách 100m-15p đi TT Hà ",5,Quận Hà Đông ,"3,2 ",107,30,nhà ở
"NHÀ ĐẸP TẠI ĐƯỜNG KIM NGƯU, 8,48  VND, 37 M2, 5 TẦNG",3,Quận Hai Bà Trưng,"8,48 ",229,37,nhà ở
"NHÀ ĐẸP TÂN TRIỀU LÔ GÓC 6TẦNG, HIỆN ĐẠI FULL CÔNG NĂNG GIÁ NHỈNH 5",8,Huyện Thanh Trì,"5,5 ",183,30,nhà ở
"NHÀ ĐẸP TẦNG 9/17 NGUYỄN THỊ ĐỊNH, TRUNG HÒA, CẦU GIẤY, ĐỦ CÔNG NĂNG",2,Quận Cầu  Giấy,"5,4 ",69,78,chung cư / căn hộ
NHÀ ĐẸP TÂY MỖ - Ở NGAY ĐÓN TẾT - 5 TẦNG ĐẸP LUNG LINH,3,Quận Nam Từ Liêm,"5,3 ",151,35,nhà ở
NHÀ ĐẸP THANH XUÂN -,5,Quận Thanh Xuân,"7,5 ",221,34,nhà ở
"Nhà đẹp Trần Cung 38m2, 35m bãi xe ô tô, nhà đẹp full nội thất ở ngay",3,Quận Bắc Từ Liêm,"5,6 ",147,38,nhà ở
NHÀ ĐẸP TRUNG TÂM XUÂN ĐỈNH - 40M2-CÓ GARA OTO-NHÀ MỚI- NGÕ TO GẦN PHỐ,3,Quận Bắc Từ Liêm,6,150,40,nhà ở
Nhà đẹp Trương Định- Hai Bà Trưng,4,Quận Hai Bà Trưng,"8,15 ",131,62,nhà ở
"NHÀ ĐẸP VẠN PHÚC, HÀ , FULL NT  - Ô TÔ  - 38, 5 TẦNG - CHỈ 8X ",4,Quận Hà Đông ,"8,5 ",224,38,nhà ở
NHÀ ĐẸP VĂN TIẾN DŨNG Ở NGAY - NGÕ NÔNG - 20M Ô TÔ - 100M BÃI ĐỖ XE.,3,Quận Bắc Từ Liêm,"5,7 ",163,35,nhà ở
Nhà đẹp -Võng Thị Tây Hồ Sân Xinh Ở ngay 35mx3 Ngủ 5  7.,3,Quận Tây Hồ,"5,7 ",163,35,nhà ở
"NHÀ ĐẸP XÂY MỚI 7 TẦNG, NHÀ 2 MẶT THOÁNG, Ô TÔ ĐỖ TRONG NHÀ",3,Quận Long Biên,"12,75 ",266,48,nhà ở
Nhà đẹp xây mới Chương Mỹ - Giá rẻ nhà đẹp vào ở ngay !!!,3,Huyện Chương Mỹ,"2,618",84,31,nhà ở
"Nhà đẹp, cách ô tô 10m, gần Phố Tân Ấp, Ba Đình, Hà Nội",3,Quận Ba Đình,"5,15 ",184,28,nhà ở
"NHÀ ĐẸP-THANG MÁY-NỞ HẬU-Ô TÔ ĐỖ - BÃI GỬI Ô TÔ CÁCH 30M, 44m2x 6 tầng",4,Quận Bắc Từ Liêm,"11,65 ",265,44,nhà ở
"Nhà Di Trạch - đơn lập 4 tầng 36m2 - giá chỉ 3,x  -",3,Huyện Hoài Đức,"3,95 ",110,36,nhà ở
NHÀ DI TRẠCH (ko quy hoạch),3,Huyện Hoài Đức,"4,15 ",130,32,nhà ở
"nhà diện tích 33.7/35m2, mặt tiền 4m2 tương mai hai bà trưng",5,Quận Hai Bà Trưng,"7,48 ",222,34,nhà ở
Nhà Độc Lập - Diện Tích Siêu Lớn OTO Qua Nhà,3,Huyện Quốc Oai,"3,55 ",55,65,nhà ở
"Nhà Đội Cấn – 70 x 4 tầng, kinh doanh sầm uất - đầu tư vàng",4,Quận Ba Đình,11,157,70,nhà ở
nhà  nhân  la Hoài Đức ô tô vào tận nơi,4,Huyện Hoài Đức,"3,65 ",122,30,nhà ở
"NHÀ DÒNG TIỀN 50 TRIỆU/THÁNG, 10 PHÒNG KHÉP KÍN, 6 TẦNG, THANG MÁY -",10,Quận Hai Bà Trưng,"10,9 ",232,47,nhà ở
"Nhà gần ĐH Đại~60m2x5T,13 PKK/full đồ/thangmáy+thoát hiểm~600tr/năm",10,Quận Hà Đông ,"9,95 ",166,60,nhà ở
Nhà gần phố ngõ ô tô xây 4 tầng x 36m2 nhận nhà ngay,3,Quận Hoàng Mai,"5,5 ",153,36,nhà ở
"Nhà gần trường ĐH Đại  38m2x5T, 7/100m ra thẳng QL 21B ở+cho thuê",7,Quận Hà Đông ,"6,05 ",159,38,nhà ở
Nhà giá quá rẻ 3 tầng chưa tới 3 ,2,Quận Ba Đình,"2,75 ",72,38,nhà ở
Nhà Hạ Hội - Tân Lập - 40m2 xây đơn lập - giá nhỉnh 4 ,4,Huyện Đan Phượng,"4,3 ",108,40,nhà ở
"Nhà hai mặt thoáng Văn Chương, nội thất xịn, 5 bước ô tô, nhỉnh 9 ",4,Quận Đống Đa,"9,2 ",219,42,nhà ở
NHÀ HAI MẶT TIỀN PHỐ NGUYỄN TRÃI - THANH XUÂN 110M2 X 7 TẦNG THANG MÁY,4,Quận Thanh Xuân,50,625,80,nhà ở
"NHÀ HIẾM CÁCH MẶT PHỐ 10m.5Tầng ,Diện tích 38m2, mặt tiền 4.8m,",4,Quận Thanh Xuân,"6,8 ",179,38,nhà ở
"Nhà hiếm Giang Văn Minh ,kinh doanh ,oto,2 thoáng,dt 28 m2 5tầng.",3,Quận Ba Đình,"4,55 ",163,28,nhà ở
"Nhà hiếm Giảng Võ ,kinh doanh , sát mặt phố ,2 thoáng,dt 38 m2 5tầng.",3,Quận Đống Đa,"5,38 ",142,38,nhà ở
"Nhà Hoàng Văn Thái ,Ô TÔ  sổ 51chào 6.80 ",3,Quận Thanh Xuân,"6,8 ",133,51,nhà ở
"Nhà Khu Bích Hòa,gần KCN Thanh Oai,34m-3T-3 về ở ngay, nhà cực đẹp",3,Huyện Thanh Oai,"3,3 ",97,34,nhà ở
"Nhà khu Liên Ninh, 4 tầng 3 ngủ đường Nội Am, giá hơn 4 ",3,Huyện Thanh Trì,"4,55 ",114,40,nhà ở
nhà kim chung yên vĩnh,3,Huyện Hoài Đức,"4,75 ",148,32,nhà ở
Nhà La Tinh Hoài Đức Gần Trục Chính Ô tô,4,Huyện Hoài Đức,"3,7 ",123,30,nhà ở
Nhà Lai Xá - Kim Chung - cạnh chợ - 5 tầng - sẵn nội thất,3,Huyện Hoài Đức,"4,3 ",143,30,nhà ở
"Nhà Liền Kề 80m, đường 17m, vỉa hè 3m,Khu Đô Thị Tân Tây Đô",4,Huyện Đan Phượng,12,150,80,nhà ở
Nhà Lô Góc - 40M2 - 5 Tầng - Đại Cát Liên Mạc - Ô Tô Vào Nhà - Giá 6.2,4,Quận Bắc Từ Liêm,"6,2 ",155,40,nhà ở
Nhà Lô Góc - 46M2 - 5 Tầng - MT 6.5m - Đại Cát Liên Mạc - 5.9 ,8,Quận Bắc Từ Liêm,"5,9 ",128,46,nhà ở
Nhà Lô Góc  La - OTO Đỗ Của Chỉ 5p Ra KĐT Đô Nghĩa,3,Huyện Hoài Đức,4,125,32,nhà ở
"Nhà lô góc, ôt đậu cửa,33m-4T full đồ về ở ngay,Bích Hòa",3,Huyện Thanh Oai,"3,5 ",109,32,nhà ở
"nhà mặt đất 30m2, 3 ngủ, mặt tiền 4.1m, đường Cổ Nhuế",3,Quận Bắc Từ Liêm,6,200,30,nhà ở
Nhà mặt đường đê Tràn Khát Trân ô tô vào nhà đnag kinh doanh,4,Quận Hai Bà Trưng,23,256,90,nhà ở
"NHÀ MẶT ĐƯỜNG KINH DOANH GÓC GẦN KHU ĐÔ THỊ ĐÔ NGHĨA 50M2X5T CHỈ 3,8TY",4,Huyện Quốc Oai,"3,8 ",76,50,nhà ở
"NHÀ MẶT NGÕ NGUYỄN VĂN CỪ, NGÕ Ô TÔ KINH DOANH, MẶT TIỀN RỘNG",2,Quận Long Biên,16,182,88,nhà ở
"Nhà mặt ngõ ô tô 55m2, 3 phòng ngủ, đường Lương Định Của, Q. Đống Đa",3,Quận Đống Đa,"16,8 ",305,55,nhà ở
"NHÀ MẶT NGÕ Ô TÔ KHU QUÂN ĐỘI . DT:55m2, 5T, mt4m, Giá 10.8",6,Quận Thanh Xuân,"10,8 ",196,55,nhà ở
Nhà mặt ngõ rộng,10,Quận Thanh Xuân,28,311,90,nhà ở
"NHÀ MẶT NGÕ RỘNG 5M , Ô TÔ ĐỖ TRONG NHÀ, DT36M2 GIÁ CHỈ 2,5 TY",4,Huyện Hoài Đức,"2,5 ",69,36,nhà ở
"Nhà Mặt Phố Hàng Đường, Ngã 4 Hàng Chiếu,Trung Tâm Phố Cổ, Q.Hoàn Kiếm",3,Quận Hoàn Kiếm,"13,5 ",964,14,nhà ở
Nhà Miếu Đầm sổ 65 m  xây 74 m  4  tầng 4 phong khép kín giá 15 ,4,Quận Nam Từ Liêm,15,231,65,nhà ở
Nhà Miếu Đầm sỗ đỏ 56  12 phòng kép kín tầng giá 13.3 ,10,Quận Nam Từ Liêm,"13,3 ",238,56,nhà ở
Nhà mới 5 tầng 50m nội thất xịn xò ở Thạch Bàn Long Biên,3,Quận Long Biên,"8,1 ",162,50,nhà ở
"NHÀ MỚI 6 TẦNG THANG MÁY, GARA Ô TÔ, PHỐ ĐÀM QUANG TRUNG, GIÁ HƠN 8 ",5,Quận Long Biên,"8,9 ",223,40,nhà ở
NHÀ MỚI -BÁN NHÀ NGỌC THUỴ LONG BIÊN- NGÕ Ô TÔ DT  58 m2 GIÁ : 13.8 ,5,Quận Long Biên,"13,8 ",238,58,nhà ở
NHÀ MỚI ĐÓN TẾT - 6 TẦNG - OTO CẠNH NHÀ - NGÕ NÔNG,3,Quận Long Biên,5,167,30,nhà ở
"NHÀ MỚI ĐÓN TẾT - NGỌC TRỤC, FULL NỘI THẤT -MẶT NGÕ Ô TÔ, KINH DOANH",4,Quận Nam Từ Liêm,"7,8 ",217,36,nhà ở
NHÀ MỚI ĐÓN TẾT-3 NGỦ RỘNG THOÁNG-OTO ĐỖ CÁCH 10M-CÁCH HỒ ĐIỀU HOÀ 50M,3,Huyện Đông Anh,"3,35 ",80,42,nhà ở
"Nhà mới Kim Chung, 15m ô tô đỗ, 30m ô tô tránh, 36,5m 4,85 ",5,Huyện Hoài Đức,"4,85 ",133,37,nhà ở
NHÀ MỚI KOONG,3,Quận Hai Bà Trưng,"8,28 ",184,45,nhà ở
NHÀ MỚI KOONG - GẦN PHỐ - Ô TÔ ĐỖ CỬA - NGÕ ĐẸP - TIỆN ÍCH NGẬP TRÀN,3,Quận Hoàng Mai,"5,1 ",134,38,nhà ở
"NHÀ MỚI- NGÕ Ô TÔ - KINH DOANH- LIÊN NINH- THANH TRÌ- 42,5M- 5,4",4,Huyện Thanh Trì,"5,4 ",127,43,nhà ở
"Nhà mới ở ngay  Thụy Khuê 38m nhà  5 tầng , Mt  4.2m giá  7.1 ",3,Quận Tây Hồ,"7,1 ",187,38,nhà ở
Nhà Mới Phố Đào Tấn.Liễu Giai.Ba Đình.DT 38M X5 Tầng.Giá 6.9 ,3,Quận Ba Đình,"6,9 ",192,36,nhà ở
Nhà Mới Phố Văn Hội.Đức Thắng.Bắc Từ Liêm.DT 36M x 5 Tầng.Giá 5.15 ,3,Quận Bắc Từ Liêm,"5,15 ",143,36,nhà ở
"Nhà mới tinh 4 tầng 38m2,full nội thất,gần đại học TDTT,Yên Nghĩa 3km",3,Huyện Chương Mỹ,"2,26 ",59,38,nhà ở
NHÀ MỚI TỰU LIỆT-HÀNG XÓM LINH ĐÀM P🍀🍀✳️GẦN NGAY BẾN XE NƯỚC NGẦM OTT,4,Huyện Thanh Trì,"5,35 ",149,36,nhà ở
Nhà mới xây 30m2 x 5 tầng cách vài nhà ra đường ô tô,3,Quận Hoàng Mai,5,167,30,nhà ở
"Nhà mới xây ở 3 tầng, gần vành đai 4 về Mỹ đình hơn 10km, chủ bán rẻ",3,Huyện Đan Phượng,"3,2 ",74,43,nhà ở
"Nhà mới xây Phụng Châu, Đường, Ngõ cực rộng Ô tô vào tới cửa",3,Huyện Chương Mỹ,"2,3 ",77,30,nhà ở
"Nhà mới, giá tốt  cạnh QL6, Cầu Mai Lĩnh Cơ hội vàng cho khách hàng",3,Quận Hà Đông ,"2,3 ",72,32,nhà ở
"Nhà Mới, Ô Tô Vào Nhà Giải Phóng 42 m, 7 tầng, mt 4m, giá 13.5 .",5,Quận Thanh Xuân,"13,5 ",321,42,nhà ở
"Nhà Mỹ Đình 58m2; 9,25  - 4 tầng dân xây.",5,Quận Nam Từ Liêm,"9,25 ",159,58,nhà ở
NHÀ NÉT THANH XUÂN - BÙI XƯƠNG TRẠCH,4,Quận Thanh Xuân,"13,7 ",211,65,nhà ở
"Nhà ngay chợ,UBND về ở ngay-ô tô nhỏ đỗ cổng DT 40m2 gần Yên NGhĩa",3,Huyện Quốc Oai,"2,8 ",70,40,nhà ở
Nhà Ngõ 1181 Quang Trung đã có sổ đỏ,3,Quận Hà Đông ,"4,5 ",150,30,nhà ở
Nhà Ngõ 207 Xuân Đỉnh 5 Tầng Thang Máy Ngõ Ba Gác Gần Ngoại Giao Đoàn.,3,Quận Bắc Từ Liêm,"7,5 ",225,33,nhà ở
"Nhà ngõ 34 m2, phố Cầu Cốc,  Từ Liêm, Hà Nội",3,Quận Nam Từ Liêm,"4,1 ",120,34,nhà ở
"Nhà Ngõ 68 Cầu Giấy, Ô tô đỗ Cổng, 5 tầng, ngõ thoáng, gần phố, ở luôn",4,Quận Cầu Giấy,"6,5 ",171,38,nhà ở
NHÀ NGÕ RỘ0NG  3NGỦ 4T FULL NỘI THẤT,3,Quận Thanh Xuân,"5,8 ",193,30,nhà ở
"Nhà Ngọc Lâm Lô Góc +Gara oto + thang máy:Dt:64m2 x 4T, giá 10.5 ",4,Quận Long Biên,"10,5 ",164,64,nhà ở
Nhà Ngọc Thụy sang đẹp ở luôn. 42m2. Giá chỉ 4.6 ,3,Quận Long Biên,"4,6 ",110,42,nhà ở
"nhà Nguyễn Hoàng Tôn, Tây Hồ 40m2, 11,2 ",4,Quận Tây Hồ,"11,2 ",280,40,nhà ở
NHÀ Ở BÙI XƯƠNG TRẠCH,6,Quận Thanh Xuân,"10,7 ",238,45,nhà ở
Nhà Ở Vành Đai 4 Đan Phượng Hà Nội,1,Huyện Đan Phượng,"2,9 ",44,67,nhà ở
"nhà phân lô , ô tô đỗ cửa , sổ nở hậu",4,Quận Hà Đông ,"4,1 ",137,30,nhà ở
"Nhà phân lô Hoàng Quốc Việt, Cầu Giấy, 61, 7 tầng, 5m, nhỉnh 24 .",6,Quận Cầu Giấy,"24,5 ",401,61,nhà ở
NHÀ PHÂN LÔ MT4M - Ngõ nông - ô tô - thông sàn kinh doanh 35m2*5T,3,Quận Đống Đa,6,171,35,nhà ở
NHÀ PHÂN LÔ NGÕ 325 KIM NGƯU-50M2-Ô TÔ ĐỂ TRONG NHÀ-CHỈ 13tỉ8-4 TẦNG,4,Quận Hai Bà Trưng,"13,8 ",276,50,nhà ở
Nhà phân lô ngõ ô tô 35m2 x 4 tầng ở kinh doanh,3,Quận Hoàng Mai,6,171,35,nhà ở
NHÀ PHÂN LÔ PHÚ DIỄN- BẮC TỪ LIÊM 40M2- VỈA HÈ- Ô TÔ TRÁNH- GIÁ 9.2 ,2,Quận Bắc Từ Liêm,"9,2 ",230,40,nhà ở
NHÀ PHÂN LÔ PHÚ DIỄN- GARA ÔTÔ- KINH DOANH- 60M2- 6 TẦNG- GIÁ 11.8 .,4,Quận Bắc Từ Liêm,"11,8 ",197,60,nhà ở
"NHÀ PHỐ BỒ ĐỀ- LONG BIÊN, 62M2,5 TẦNG,13.8 .KINH DOANH- Ô TÔ NGỦ.",4,Quận Long Biên,"13,8 ",265,52,nhà ở
NHÀ PHỐ CỔ - HOÀN KIẾM - 25M2- TÀI CHÍNH 6  -NGÕ 3 GÁC Ô TÔ CÁCH 10m,3,Quận Hoàn Kiếm,6,240,25,nhà ở
"Nhà phố Đại La, Hai Bà Trưng, lô góc, ô tô tải đỗ cửa, ngõ thông, kinh",3,Quận Hai Bà Trưng,"7,35 ",245,30,nhà ở
NHÀ PHỐ ĐÌNH THÔN - KD Ở ĐỀU VƯỢNG- 45Mx5T- DÂN XÂY CHẮC CHẮN,8,Quận Nam Từ Liêm,8,186,43,nhà ở
"Nhà phố Đội Cấn – 72 x 4 tầng, không gian siêu rộng rãi giá ưu đãi",4,Quận Ba Đình,11,153,72,nhà ở
"NHÀ PHỐ HOÀNG VĂN THÁI - KINH DOANH - Ô TÔ VÀO NHÀ 55M x 5 TẦNG 11,5",5,Quận Thanh Xuân,"11,5 ",209,55,nhà ở
Nhà phố Kim Mã 25m - 3.2ty. 4 tầng 3 phòng ngủ,3,Quận Ba Đình,"3,2 ",128,25,nhà ở
"Nhà phố liền kề trung tâm Trâu Quỳ, Gia Lâm 16,3 ",6,Huyện Gia Lâm,"16,3 ",181,90,nhà ở
Nhà phố Minh khai,3,Quận Hai Bà Trưng,"3,4 ",170,20,nhà ở
"Nhà phố Nguyễn Chính 30/33m sổ đỏ chính chủ, cần bán",3,Quận Hoàng Mai,"5,7 ",173,33,nhà ở
"NHÀ PHỐ THẠCH CẦU, BÁT KHỐI LONG BIÊN, CẠNH CẦU VĨNH TUY, Ô TÔ ĐỖ CỬA",2,Quận Long Biên,7,64,110,nhà ở
"Nhà phố Thái Thịnh, vị trí vàng 71m2 ô tô tránh xe tải 7T thang máy KD",10,Quận Đống Đa,33,465,71,nhà ở
Nhà phố Thanh Nhàn -Bạch Mai,4,Quận Hai Bà Trưng,"4,85 ",202,24,nhà ở
"Nhà phố Tô Ngọc Vân, Tây Hồ, 56, 3 tầng, hơn 22 , ngõ ô tô tránh",6,Quận Tây Hồ,"22,4 ",400,56,nhà ở
NHÀ PHƯƠNG CANH 60M2 4 NGỦ CÓ SÂN ĐỂ XE,4,Quận Nam Từ Liêm,"6,9 ",115,60,nhà ở
"Nhà Quan Hoa, 5 Tầng, Dt 40m, Giá 8,4  Gần Ôtô, Ngõ Thông, Gần Chợ",4,Quận Cầu Giấy,"8,4 ",210,40,nhà ở
"Nhà Rất Đẹp 68 Cầu Giấy Dt 40m Giá 8,4  Ngõ Thông Gần Ôtô, Full Đồ",4,Quận Cầu Giấy,"8,4 ",210,40,nhà ở
nhà rẻ đẹp thư Phú thường tín,2,Huyện Thường Tín,"2,1 ",24,87,nhà ở
nhà rẻ sát chợ tự nhiên thường tín,2,Huyện Thường Tín,"2,26 ",21,108,nhà ở
"Nhà riêng Đại Tự,Hoài Đức 35m2 4T,ngõ thông, ô tô 30m giá chỉ 3,7 ",4,Huyện Hoài Đức,"3,7 ",106,35,nhà ở
"NHÀ RIÊNG TẠI PHỐ BẠCH MAI, 6,8 /47 m2,~140Tr/1m ,6 , 5 WC 4 tầng",6,Quận Hai Bà Trưng,"6,8 ",145,47,nhà ở
"Nhà rộng giá rẻ nội thất đẹp,rất hiếm,vị trí thuận tiện mọi mặt đi lại",3,Quận Hai Bà Trưng,"5,8 ",135,43,nhà ở
"Nhà sát 93 Vương Thừa Vũ, 10m oto tránh,, ở hoặc cho thuê tốt, 37m2*4T",3,Quận Thanh Xuân,"7,2 ",195,37,nhà ở
"Nhà Tả Thanh Oai, vị trí đẹp, dt 36m, 4 tầng. gần Oto. Full nội thất",4,Huyện Thanh Trì,"3,45 ",96,36,nhà ở
"Nhà Tân Lập - Đan Phượng - vị trí đẹp - ngõ nông - giá 3,x ",3,Huyện Đan Phượng,"3,5 ",109,32,nhà ở
NHÀ TẬP THỂ 50 MÉT ĐẸP LÔ GÓC - THOÁNG SÁNG- CHỦ TÂM HUYẾT -,2,Quận Đống Đa,"2,45 ",49,50,nhà ở
"NHÀ TẬP THỂ QUỲNH MAI, 3,35  VND, 35,3/60m2 -2NGỦ-2WC-1KHÁCH-SOS",2,Quận Hai Bà Trưng,"3,35 ",95,35,nhà ở
"Nhà Thạch Bàn _Sát Aeon,Dân Xây+full N/ thất_nét:4,9 _43mx4T_Mt:4,3",3,Quận Long Biên,"4,9 ",114,43,nhà ở
"Nhà Thạch Bàn -Sát Aoen :35m2 x 6T ,Mt :4m , Nét 4,4  - Oto Đỗ Cửa ,",4,Quận Long Biên,"4,4 ",126,35,nhà ở
NHÀ THANG MÁY XÂY MỚI ĐẸP NHẤT CẦU GIẤY-OTO ĐỖ CỔNG-4.1MMTx6T- GIÁ8.5T,4,Quận Cầu Giấy,"8,5 ",189,45,nhà ở
"NHÀ THANH BÌNH MỖ LAO HÀ , 35M, 5T, MT4,6M, GIÁ 7,65 ",3,Quận Hà Đông ,"7,65 ",219,35,nhà ở
"Nhà thật, giá thật chỉ 28, xây mới cách đường ô tô chỉ 20m",4,Huyện Hoài Đức,"2,8 ",88,32,nhà ở
"Nhà thiết kế có Gara oto 35m2x3T, đường 5m, 3.5km Penika Tố Hữu",3,Huyện Quốc Oai,"3,25 ",93,35,nhà ở
nhà Thôn Nội - Đức Thượng - ngõ nông - gần 32 - 40m2 4 tầng,4,Huyện Hoài Đức,4,100,40,nhà ở
NHÀ TÔ VĨNH DIỆN - 45 m2 - MẶT TIỀN KHỦNG - LÔ GÓC,5,Quận Thanh Xuân,"8,6 ",210,41,nhà ở
"Nhà Trung kính ngõ to gần ô tô 15m,mặt tiền khủng,2 thoáng ở sướng",5,Quận Cầu Giấy,9,164,55,nhà ở
Nhà Trung Tâm La Phù-Ôtô Đỗ Gần Về Ở Luôn-5Phút Ra Lê Trọng Tấn,3,Huyện Hoài Đức,"3,8 ",119,32,nhà ở
"NHÀ TRƯỜNG CHINH FULL NỘI THẤT LUNG LINH, ĐỐNG ĐA 38M x 5T CHỈ 7600",6,Quận Đống Đa,"7,6 ",200,38,nhà ở
Nhà TT Phùng - 4 tầng đơn lập - gần 50m2 - đủ công năng - cạnh bến xe,4,Huyện Đan Phượng,"3,5 ",74,47,nhà ở
Nhà TT Trôi - Hoài Đức - 4 tầng đơn lập - 40m2 - giá chỉ ngoài 3 ,4,Huyện Hoài Đức,"3,7 ",93,40,nhà ở
"Nhà ven đô sát Đồng Mai,38mx3T,ôtô vào cửa,full nội thất,giá nhỉnh 2",3,Huyện Thanh Oai,"2,195",58,38,nhà ở
"Nhà View Đẹp - Siêu Thoáng. Chỉ 2,42 3Tx34m - 10Phút Ra BX Yên Nghĩa",3,Huyện Chương Mỹ,"2,26 ",65,35,nhà ở
NHÀ VƯƠNG THỪA VŨ- - THANH XUÂN,4,Quận Thanh Xuân,"14,6 ",243,60,nhà ở
"Nhà xây mới 33m-5T 4P- o tô đậu cổng,Bích Hòa,Thanh oai",3,Huyện Thanh Oai,"3,05 ",95,32,nhà ở
"Nhà xây mới 34m-4T-5 lô góc ngõ thông,",4,Quận Hà Đông ,"4,8 ",141,34,nhà ở
"Nhà xáy mới 5 tầng thang máy full nội thất,vị trí hiếm cạnh KĐT Đền Lừ",3,Quận Hoàng Mai,"7,4 ",211,35,nhà ở
"Nhà Yên Hoà Cầu giấy ngõ to thông ô tô 5 tạ đỗ,nhà mới,ở hoặc cho thuê",7,Quận Cầu Giấy,8,160,50,nhà ở
"Nhà Yên nghĩa, 50m ra quốc lộ 6,35m-4T-4gác lửng,ở ngay",4,Quận Hà Đông ,"5,6 ",160,35,nhà ở
"Nhanh chân còn kịp! Thái Hà, lô góc, 5m ô tô tránh, thang máy",5,Quận Đống Đa,"9,98 ",166,60,nhà ở
"NHANH MỚI KỊP- PHẠM VĂN ĐỒNG,Ô TÔ TRÁNH-SÁT PHỐ -KINH DOANH-CỰC THOÁNG",2,Quận Bắc Từ Liêm,"8,9 ",247,36,nhà ở
"Nhanh tay kẻo hết, nhà cực hiếm 36m2 chỉ 2,2  ô tô đỗ cửa",3,Huyện Chương Mỹ,"2,2 ",61,36,nhà ở
"Nhỉnh 2  - nhà 3 tầng - ô tô đỗ gần, Cách 1,km QL6. 15p Bx Yên Nghĩa",3,Huyện Chương Mỹ,"2,05 ",60,34,nhà ở
"Nhỉnh 2 , 33m2 Giáp Biên Giang, xe bus gần 10p BX Yên Nghĩa.",3,Huyện Chương Mỹ,"2,05 ",62,33,nhà ở
NHỈNH 4  - CÓ NHÀ MỚI 5 TẦNG Ở LA PHÙ HOÀI ĐỨC.,3,Huyện Hoài Đức,4,133,30,nhà ở
"NHỈNNH 4  CÓ NGAY NHÀ LÔ GÓC , GẦN QL6 , VÀNH ĐAI 4.DT 35m × 5 tầng",3,Quận Hà Đông ,"4,55 ",130,35,nhà ở
Nhượng căn nhà đẹp giá rẻ ở Thường Tín,2,Huyện Thường Tín,"1,96 ",37,53,nhà ở
NÓNG!  MỞ BÁN 20 căn nhà tại Đại Thành - ngày gần KDT ĐÔ NGHĨA,4,Huyện Quốc Oai,"2,5 ",60,42,nhà ở
