Tiêu đề,Số phòng ,Vị trí,Giá ,Giá / Diện tích,Diện tích,Loại hình
"‼️ THÁI HÀ KHU PHÂN LÔ, NHỈNH 4 ĐỒNG⭐️",3,Quận Đống Đa,"4,39 ",231,19,nhà ở
‼️CĂN HỘ 103M2 MỸ ĐÌNH PLAZA 2 - SẴN NỘI THẤT - GIÁ👉  NHỈNH 7 ,3,Quận Nam Từ Liêm,7,68,103,chung cư / căn hộ
"""Bán nhà phố Hoàng Mai, Hoàng Văn Thụ, 32m, 5 tầng. Giá: 6.5 ",3,Quận Hoàng Mai,"6,5 ",203,32,nhà ở
"# HOÀNG MAI #  THIÊN - 36M x 4tầng x 4,5M mặt tiền - Giá 5,75 ",5,Quận Hoàng Mai,"5,9 ",164,36,nhà ở
#THANH LÝ CĂN HỘ 1-2P NGỦ TRẦN CUNG - CÔNG VIÊN HÒA BÌNH - SỔ RIÊNG,2,Quận Bắc Từ Liêm,"1,15 ",18,65,chung cư / căn hộ
#THANH XUÂN# QUAN NHÂN# HÀ NỘI - 46M x 5TẦNG x 4M MẶT TIỀN - 3 THOÁNG,5,Quận Thanh Xuân,"9,9 ",215,46,nhà ở
"* Giá  3 ,45.Chung cư nguyễn chánh Cầu Giấy. * Diện tích 44m2.",1,Quận Cầu  Giấy,"3,45 ",78,44,chung cư / căn hộ
"*** Bìa Làng Cổ Loa, 46m, Giá Chỉ hơn 3 ",2,Huyện Đông Anh,"3,6 ",78,46,nhà ở
"[BÁN BĐS] NHÀ ĐẤT KHU TỨ LIÊN DT 50.6 M2, MT hơn 4M, giá hợp lý !",3,Quận Tây Hồ,"7,3 ",144,51,nhà ở
[CHÍNH CHỦ BÁN NHÀ] NGÕ 190 HOÀNG MAI - VỊ TRÍ ĐẸP - HIẾM - GIÁ TỐT,6,Quận Hoàng Mai,"6,5 ",186,35,nhà ở
"[Chính chủ] Bán nhà mặt phố VIP - 15/176 Nguyễn Sơn, Long Biên, Hà Nội",5,Quận Long Biên,"19,999",227,88,nhà ở
"[Lạc Long Quân - Tây Hồ] Bán nhà , 5p ra hồ Tây hóng gió",6,Quận Tây Hồ,"8,75 ",192,46,nhà ở
"_ CĂN HỘ FUN NỘI THẤT  THOÁNG PHÙ HỢP  VKCK  TRẺ  GIÁ 1,35  .",2,Quận Thanh Xuân,"1,35 ",39,35,chung cư / căn hộ
"♥️Hiếm,Bán nhà Phân Lô Ôtô, Vỉa hè Khuất Duy Tiến 53/58m, chỉ  19.5 ",4,Quận Thanh Xuân,"19,5 ",336,58,nhà ở
♦️ MUA ĐẤT TẶNG NHÀ NẰM NGAY TẠI CỔNG LỤC QUÂN - SƠN TÂY- HÀ NỘI,3,Thị Xã Sơn Tây,"1,35 ","7,5",179,nhà ở
"✈️✈️Bán Nhà 2 tầng Vân Nội 🌸 Ngõ thông, đường rộng 🌸 Ô Tô đỗ cửa 🌸",2,Huyện Đông Anh,"3,75 ",71,53,nhà ở
"✍️ HIẾM ĐƯỜNG BƯỞI MẶT PHỐ BA ĐÌNH NHÀ 2MẶT TIỀN ,GIÁ BÁN ĐẤT",3,Quận Ba Đình,22,237,93,nhà ở
✴️ MAI DỊCH 70m2 x 6 TẦNG THANG MÁY - CHỈ HƠN 15 . Ô TÔ,5,Quận Cầu Giấy,15,214,70,nhà ở
✴️ MAI DỊCH 70m2 x 6 TẦNG THANG MÁY - CHỈ HƠN 15 . Ô TÔ,5,Quận Cầu Giấy,15,214,70,nhà ở
❇️ NHÀ ĐẸP PHỐ LÊ ĐỨC THỌ 38Mx5T- NGÕ THÔNG Ô TÔ -DÂN XÂY CHẮC,4,Quận Nam Từ Liêm,"6,5 ",171,38,nhà ở
❤️❤️BÁN NHÀ ĐẸP MẶT NGÕ 31 YÊN LỘ -dt 40m-5 tầng -GARA OTO -7.5 ,4,Quận Hà Đông ,"7,5 ",167,45,nhà ở
❤️🔥Bán nhà 2 tầng 68m2 (Xây Thô) tại Bến Trung Bắc Hồng 🔹 Ô Tô Vào 🔹,2,Huyện Đông Anh,"3,15 ",46,68,nhà ở
❤️🔥Vùng đất Vàng🔹Nhà 3 tầng 52m2 rẻ nhất Vĩnh Ngọc  Anh🔹Ngõ ô tô 🚘,3,Huyện Đông Anh,"3,85 ",74,52,nhà ở
✅ B ÁN NHÀ Minh Khai - Hai Bà Trưng,3,Quận Hai Bà Trưng,6,333,18,nhà ở
✅ B ÁN NHÀ Nhân Hòa - Thanh Xuân,6,Quận Thanh Xuân,"12,5 ",357,35,nhà ở
✅ B ÁN NHÀ Quang Lãm - Hà ,5,Quận Hà Đông ,"4,75 ",148,32,nhà ở
✅ B ÁN NHÀ Tam Trinh - Hoàng Mai,5,Quận Hoàng Mai,"6,7 ",97,69,nhà ở
✨ KIM NGƯU - ÔTÔ ĐỖ CỬA - NGẬP TRÀN TIỆN ÍCH 🔥 37M2 – 5 TẦNG –  8.5 ,3,Quận Hai Bà Trưng,"8,48 ",229,37,nhà ở
"⛳️⛳️⛳️ NHÀ TẬP THỂ THẠCH BÀN, LÔ GÓC, CỰC THOÁNG,",2,Quận Long Biên,"1,7 ",61,28,nhà ở
"⭐⭐⭐ Bán nhà phố Trương Định , dt 60m , ngõ thông thoáng, giá 6 ty 3",5,Quận Hai Bà Trưng,"6,3 ",105,60,nhà ở
"1  có ngay căn hộ chung cư mini 1 ngủ, 1 WC 35m2 Tây Hồ",1,Quận Tây Hồ,"1,395",40,35,chung cư / căn hộ
1 CĂN *** THỤY KHUÊ MẶT NGÕ THÔNG KD Ô TÔ ĐỖ CỬA 10M RA MẶT PHỐ,3,Quận Tây Hồ,"7,68 ",240,32,nhà ở
"10 Căn Chuyển Nhượng Giá Rẻ 1-3 Khu S, GS, SA, Imperia, Tonkin,Mas",2,Quận Nam Từ Liêm,"3,25 ",60,54,chung cư / căn hộ
105 XUÂN LA  67M2 4 TẦNG PHÂN LÔ  ÔTÔ TRÁNH  VỈA HÈ KINH DOANH 2,5,Quận Tây Hồ,"24,5 ",366,67,nhà ở
17.99  - TOÀ CCMN THÁI HÀ ĐỐNG ĐA - Ô TÔ ĐỖ CỬA - 13 PHÒNG - LÔ GÓC,10,Quận Đống Đa,"17,99 ",290,62,nhà ở
"2  có ngay CCMN Cầu Giấy, Tầng 1, 56m2, 2 ngủ, 2 WC, SĐ đầy đủ",2,Quận Cầu  Giấy,"2,05 ",37,56,chung cư / căn hộ
"2,3  CHÂN ĐẾ ECOHOME-PHÚC LỢI - LONG BIÊN – 42,6M KINH DOANH ĐỈNH",1,Quận Long Biên,"2,3 ",54,43,chung cư / căn hộ
"2,6  CHUNG CƯ BỘ CÔNG AN – THƯỢNG THANH– THANH AM– LÔ GÓC– HÀNG HIẾM",2,Quận Long Biên,"2,6 ",37,70,chung cư / căn hộ
"2,65  có Ngay nhà 4 tầng 35m2 sát đường ô tô tránh taị Phụng Châu",3,Huyện Chương Mỹ,"2,65 ",76,35,nhà ở
"2,8 tỉ Sân riêng để Ô tô - 36m2 - 200m ra Đh thể dục - 1km ra Ql 6",3,Huyện Chương Mỹ,"2,79 ",78,36,nhà ở
"205 Xuân Đỉnh, oto qua, kinh doanh, dân xây, 34m*5T",3,Quận Bắc Từ Liêm,"5,95 ",175,34,nhà ở
"207 xUÂN ĐỈNH, Ô TÔ TRÁNH - NGÕ THÔNG CÁC NGẢ",4,Quận Bắc Từ Liêm,"6,75 ",193,35,nhà ở
2N1K KĐT mới Trung Hoà Nhân Chính,2,Quận Cầu  Giấy,6,80,75,chung cư / căn hộ
"2N1K Trung Hòa, Cầu Giấy, tặng nội thất",2,Quận Cầu  Giấy,"5,6 ",70,80,chung cư / căn hộ
"3,5 tỷ nhà Liên Mạc-35m2-5 tầng-lô góc-oto đỗ cổng-full đồ cb",4,Quận Bắc Từ Liêm,"3,5 ",100,35,nhà ở
"3.5  Cầu Giấy Hoàng Quốc Việt, Nhà Đẹp, Ngõ Nông, 3Gác Tránh Xe Máy.",3,Quận Cầu Giấy,"3,5 ",233,15,nhà ở
"3N1K STARLAKE TÂY HỒ, BAN CÔNG RỘNG",3,Quận Tây Hồ,7,71,98,chung cư / căn hộ
"3N1K TRUNG HÒA NHÂN CHÍNH, NỘI THẤT ĐẲNG CẤP",3,Quận Cầu  Giấy,"7,35 ",67,110,chung cư / căn hộ
"4,7 tỷ nhà Cầu Diễn-35m2-5 tầng-lô góc-full đồ cơ bản",4,Quận Bắc Từ Liêm,"4,7 ",134,35,nhà ở
"4,7 tỷ nhà Cầu Diễn-35m2-5 tầng-lô góc-full đồ cơ bản",4,Quận Bắc Từ Liêm,"4,7 ",134,35,nhà ở
4.05  sở hữu CH chung cư CT1 2 Ngủ Thành Phố Giao Lưu Bắc Từ Liêm,2,Quận Bắc Từ Liêm,"4,05 ",56,72,chung cư / căn hộ
4.1  - Đại Cát Liên Mạc - 35M2 - 5 Tầng - Lô Góc 2 Thoáng - Ô Tô Đỗ,6,Quận Bắc Từ Liêm,"4,1 ",117,35,nhà ở
4.2  nhà mặt ngõ 6 Tả Thanh Oai ô tô đỗ gần nhà còn như mới,5,Huyện Thanh Trì,"4,2 ",117,36,nhà ở
"4.3  mặt ngõ 33m xây 5 tầng ngõ 6 Tả Thanh Oai,ngay cầu Tó Đại Thanh",3,Huyện Thanh Trì,"4,3 ",130,33,nhà ở
40m2 ô tô đỗ cửa - 500m ra Đại Lộ Thăng Long nhà đẹp 4 tầng về ở ngay,4,Huyện Hoài Đức,"3,3 ",80,41,nhà ở
"40m2 Sẵn Nhà Mới, Oto 7 chỗ đỗ sát nhà. Thôn 3 Vạn Phúc. GIÁ RẺ",2,Huyện Thanh Trì,"2,89 ",72,40,nhà ở
"47 -BIỆT THỰ VIP TỨ HIỆP, THANH TRÌ-Ở SƯỚNG-AN SINH ĐỈNH- GIÁ ĐẦU TƯ",7,Huyện Thanh Trì,47,214,220,nhà ở
5  200 ô tô đỗ cổng 36m xây 5 tầng ngay đèn xanh đổ tổ 9 Mậu lương,3,Quận Hà Đông ,"5,2 ",144,36,nhà ở
5.78 -38M2-4 NGỦ-NHÀ DÂN-207 TRƯƠNG ĐỊNH,4,Quận Hai Bà Trưng,"5,78 ",152,38,nhà ở
"50m2 Sẵn Nhà Mới, Oto 7 chỗ đỗ sát nhà, Không Lỗi. Đại Áng. GIÁ RẺ",3,Huyện Thanh Trì,"3,6 ",72,50,nhà ở
"6.x  (x nhỏ xinh) nhà riêng Việt Hưng, Long Biên,40m-5tầng-MT4,8m",3,Quận Long Biên,"6,29 ",157,40,nhà ở
7 TẦNG THANG MÁY - 20 PHÒNG KHÉP KÍN FULL ĐỒ THU VỀ 600 TRIỆU/ NĂM.,5,Quận Hoàng Mai,"12,5 ",167,75,nhà ở
7.68 -39M2-Ô TÔ-6 NGỦ-PCCC-DƯƠNG VĂN BÉ-GẦN PHỐ,6,Quận Hai Bà Trưng,"7,68 ",197,39,nhà ở
"71M x 4 TẦNG, MT 5,4M - 9,2  - SỔ📕RIÊNG - KIM NGƯU",4,Quận Hai Bà Trưng,"9,2 ",130,71,nhà ở
Ai có nhu cầu nhà ở hoặc đầu tư xin lh,3,Huyện Mỹ Đức,"1,85 ",10,178,nhà ở
AN DƯƠNG - TÂY HỒ -ĐẤT KHÔNG SỔ - LÔ GÓC - GIÁ PHÙ HỢP VỚI TÀI CHÍNH N,1,Quận Tây Hồ,"1,2 ",35,34,nhà ở
An Dương Tây Hồ 3 Tầng Mặt Tiền Ô Tô Tránh DT 85m2 Sổ Vuông A4 17.2 ,5,Quận Tây Hồ,"17,2 ",202,85,nhà ở
"B,ÁN NHÀ LÔ GÓC – MẶT NGÕ RỘNG – KINH DOANH ĐỈNH – GẦN PHỐ CỔ",3,Quận Hoàn Kiếm,"3,9 ",144,27,nhà ở
B.á.n  nhà Khương Trung - Thanh Xuân.  30M RA PHỐ Ô TÔ - GẦN HỒ - THOÁ,3,Quận Thanh Xuân,6,162,37,nhà ở
"B.Á.N NHÀ ""MINH KHAI"" MỚI KENG - 5 TẦNG, 26M2, CHỈ 6.4 ",3,Quận Hai Bà Trưng,"6,4 ",246,26,nhà ở
"Ba Đình, nhà xây mới cứng phố Đào Tấn 5 tầng 40m mt 4,1m giá 6,9 ",3,Quận Ba Đình,"6,9 ",173,40,nhà ở
"Bà Phương bán Nhà 5 Tầng gần ngõ 26 Doãn Kế Thiện, 40m2, Mặt tiền: 7m",10,Quận Cầu Giấy,"6,05 ",151,40,nhà ở
"Bà Phương bán Nhà 5 Tầng gần ngõ 26 Doãn Kế Thiện, 40m2, Mặt tiền: 7m",10,Quận Cầu Giấy,"6,05 ",151,40,nhà ở
BÁ.N NHÀ Bồ ĐỀ 52m 6 TẦNG💥 THANG MÁY 💥GARA OTO 💥THÔNG💥 GẦN CẦU,9,Quận Long Biên,"13,9 ",267,52,nhà ở
"Bác Giang bán nhà gần ngõ 402 Mỹ Đình, 35m2, 5 Tầng, Nội thất đầy đủ",3,Quận Nam Từ Liêm,"6,25 ",179,35,nhà ở
"Bác Xuân bán Tập Thể Gần ĐH SK Điện Ảnh, Cầu Giấy, DT: 66m2, T1, 3",3,Quận Cầu  Giấy,"3,89 ",59,66,chung cư / căn hộ
"Bán  biệt thự Ciputra giai đoạn1 S180m2, nội thất đầy đủ, view đẹp",5,Quận Tây Hồ,63,350,180,nhà ở
BAN  NHÀ LẠC  LONG QUÂN . TÂY HỒ. Ô TÔ TRÁNH. NHÀ CĂN GÓC. GẦN HỒ TÂY.,6,Quận Tây Hồ,"12,3 ",256,48,nhà ở
BÁN  NHÀ NGÕ GHẠCH PHỐ CỔ - QUẬN HOÀN KIẾM - CHỈ HƠN 1  ĐỦ CÔNG NĂNG,4,Quận Hoàn Kiếm,"1,95 ",139,14,nhà ở
Bán 2 căn hộ thông tầng,4,Quận Hai Bà Trưng,"3,5 ",32,108,chung cư / căn hộ
"Bán 300m đất tặng nhà KDT Hà Phong, Tiền Phong, Mê Linh, gần trường DH",3,Huyện Mê Linh,"18,5 ",62,300,nhà ở
"Bán biệt thự 158  m2, Làng Việt Kiều Châu Âu",5,Quận Hà Đông ,"37,5 ",237,158,nhà ở
"Bán Biệt thự Full nội thất. DT 130m2, 4T vào ở được ngay",4,Huyện Gia Lâm,25,167,150,nhà ở
"Bán biệt thự Hải Âu, 100m2, 4 tầng, đường phía trước: 30m. Giá 19,2 ",4,Huyện Gia Lâm,"19,2 ",192,100,nhà ở
"Bán Biệt Thự LK Roman Plaza Tố Hữu,  Từ Liêm, 136m2 x 5T x mt 12M,",5,Quận Nam Từ Liêm,56,412,136,nhà ở
BÁN BIỆT THỰ MẶT PHỐ TỨC MẠC SIÊU SIÊU ĐẸP. MẶT TIỀN RỘNG 7.5 MÉT BỀ T,8,Quận Hoàn Kiếm,44,338,130,nhà ở
"bán biệt thự vinhomes oceanpark 1 phân khu sao biển diện tích 67,5m",6,Huyện Gia Lâm,17,252,68,nhà ở
Bán căn 110 Cầu Giấy. DT 65m - 2 2wc.,2,Quận Cầu  Giấy,"5,75 ",88,65,chung cư / căn hộ
Bán căn 22vs full đồ tại IPH Xuân Thuỷ,2,Quận Cầu  Giấy,"8,835",95,93,chung cư / căn hộ
bán căn 32wc toà C chung cư 789 Mỹ Đình cạnh THPT Trần Quốc Tuấn,3,Quận Nam Từ Liêm,"6,5 ",68,95,chung cư / căn hộ
"Bán căn 34m2x3T, Oto đỗ cửa 10 phút cầu Mai Lĩnh, 15 phút TT Hà ",3,Huyện Thanh Oai,"2,1 ",62,34,nhà ở
"Bán căn 34m2x3T, Oto đỗ cửa 10 phút cầu Mai Lĩnh, 15 phút TT Hà ",3,Huyện Thanh Oai,"1,95 ",57,34,nhà ở
"Bán căn 35m2x3T, 10 phút cầu Mai Lĩnh, 15 phút TT Hà ",3,Huyện Thanh Oai,"2,25 ",64,35,nhà ở
"Bán căn 37m2x3T, gần trường, chợ, UB, Oto đỗ",3,Huyện Chương Mỹ,"2,25 ",61,37,nhà ở
"bán căn 43wc toà Dolphin plaza mỹ đình, căn góc, view đẹp, giá tốt",4,Quận Nam Từ Liêm,14,75,186,chung cư / căn hộ
"Bán căn 46m2x4T, sổ riêng căn, Oto đỗ, đầy đủ tiện ích",3,Huyện Quốc Oai,"2,67 ",58,46,nhà ở
"Bán căn 57m2x3T, gần cầu Đại Thành, 3.5km ra Penika, Oto đỗ",3,Huyện Hoài Đức,"3,45 ",61,57,nhà ở
"Bán căn 80m2, Liền kề Dương Nội gần Aeon Mall - 4 tầng-  Chỉ hơn 14 ",6,Quận Hà Đông ,"14,8 ",185,80,nhà ở
"BÁN CĂN CC CT13  THĂNG LONG, 2 NGỦ FULL ĐỒ SẴN Ở GIÁ 4.08 ",2,Quận Tây Hồ,"4,08 ",66,62,chung cư / căn hộ
"Bán căn cc Ecohom1 56m2 gồm 2, tầng cao thoáng mát trước sau. 3.1 ",2,Quận Bắc Từ Liêm,"3,1 ",55,56,chung cư / căn hộ
"Bán Căn CC Hiếm Giá Tốt Lê Đức Thọ Vip Mỹ Đình,73m2x2,Nhỉnh 4 ",2,Quận Cầu  Giấy,"4,3 ",59,73,chung cư / căn hộ
Bán căn ccmn Hoàng Ngân Thanh Xuân mặt ngõ ô tô cực thoáng 1.6x ,1,Quận Thanh Xuân,"1,65 ",38,44,chung cư / căn hộ
Bán căn chung cư 45 Nguyễn Sơn -90m2 giá 4.6 -Long Biên,2,Quận Long Biên,"4,6 ",51,90,chung cư / căn hộ
"BÁN CĂN CHUNG CƯ CT13  THANG LONG, 2 NGỦ FULL ĐỒ ĐẸP SẴN Ở 4.08 ",2,Quận Tây Hồ,"4,08 ",66,62,chung cư / căn hộ
"BÁN CĂN CHUNG CƯ CT13  THANG LONG, ĐỐI DIỆN LOTTE TÂY HỒ, 4.7 ",2,Quận Tây Hồ,"4,7 ",70,67,chung cư / căn hộ
"BÁN CĂN CHUNG CƯ LEGACY, Thanh xuân, 122m, 7.5 ",3,Quận Thanh Xuân,"7,5 ",61,122,chung cư / căn hộ
"Bán căn chung cư mặt phố gần ngã tư sở,view cực thoáng 58m2 nhỉnh 2 ",2,Quận Thanh Xuân,"2,05 ",35,58,chung cư / căn hộ
"Bán căn Chung cư TRUN HÒA,NHÂN CHÍNH,100m,3 p ngủ,2 Wc,sổ hồng,4,97 ",3,Quận Thanh Xuân,"4,97 ",50,100,chung cư / căn hộ
"Bán căn CT5 Nguyễn Cơ Thạch. DT 86m gồm 3, 2wc.",3,Quận Nam Từ Liêm,"5,4 ",64,84,chung cư / căn hộ
"Bán căn Đại Tảo 48m2x3T, 300 trường, chợ, UB, 7 phút Penika Tố Hữu",3,Huyện Quốc Oai,"2,75 ",57,48,nhà ở
"Bán căn Độ Chàng 45m2x3T, 300 trường, chợ, UBND, 10 phút Penika Tố Hữu",3,Huyện Quốc Oai,"3,55 ",79,45,nhà ở
"Bán căn Độ Chàng 46m2x4T, 300 trường, chợ, UB, 10 phút Penika Tố Hữu",3,Huyện Quốc Oai,"2,65 ",58,46,nhà ở
"Bán căn Độ Chàng 49m2x3T, 300 trường, chợ, UB, 10 phút Penika Tố Hữu",3,Huyện Quốc Oai,"2,79 ",57,49,nhà ở
"Bán căn góc 2 chung cư 9A đường Đặng Vũ Hỷ, Long Biên. Full nội thất",2,Quận Long Biên,"2,6 ",40,65,chung cư / căn hộ
Bán căn góc 2mt 9x21/5 tầng 36 phòng 10  hẻm chợ,10,Quận Long Biên,10,56,180,nhà ở
"Bán căn góc 32WC toà FLC Landmark Mỹ Đình 6,8 ( có thương lượng )",3,Quận Nam Từ Liêm,"6,8 ",44,153,chung cư / căn hộ
"BÁN CĂN GÓC TẠI NHÂN CHÍNH 7,8  VND, 36m2, 6 , 4 WC",6,Quận Thanh Xuân,"7,8 ",217,36,nhà ở
"Bán căn góc toà cao cấp The Legacy, 120m2, 3 ngủ, tặng nội thất",3,Quận Thanh Xuân,"7,65 ",64,120,chung cư / căn hộ
"BÁN CĂN HIẾM 70M2 THỤY KHUÊ -TÂY HỒ, CHỈ 7 , BÁN GẤP TRONG TUẦN",4,Quận Tây Hồ,7,100,70,nhà ở
"BÁN CĂN HIẾM- VÕ CHÍ CÔNG-CẦU GIẤY 70M2 CHỈ 7 , XEM LÀ CỌC NGAY",4,Quận Cầu Giấy,7,100,70,nhà ở
BÁN CĂN HỘ 100 M2 CHUNG CƯ TRUNG HOÀ NHÂN CHÍNH - SỔ ĐỎ - NHÀ ĐẸP,3,Quận Thanh Xuân,"4,9 ",49,100,chung cư / căn hộ
BÁN CĂN HỘ 120 M2 TẦNG 3 TẬP THỂ MỚI KOONG LÔ GÓC PHỐ THANH NHÀN SỔ ĐO,3,Quận Hai Bà Trưng,"4,65 ",39,120,chung cư / căn hộ
"Bán căn hộ 2 68m2 tại Rice City sông Hồng - Thượng Thanh, Long Biên",2,Quận Long Biên,"3,35 ",49,68,chung cư / căn hộ
"Bán căn hộ 2 83m2 chung cư Le Grand Jardin, Full nội thất xịn sò",2,Quận Long Biên,5,60,83,chung cư / căn hộ
Bán căn hộ 3 chung cư HEITOWER 01 Ngụy Như Kontum - Thanh Xuân,3,Quận Thanh Xuân,"6,75 ",82,82,chung cư / căn hộ
"Bán căn hộ 68m2 CCMN 22 PHỐ THƯỢNG ĐÌNH, THANH XUÂN",2,Quận Thanh Xuân,"2,05 ",30,68,chung cư / căn hộ
"Bán căn hộ 8.3 Kim Ngưu: 35m2, giá 890tr, full nội thất",1,Quận Hai Bà Trưng,"0,89",25,35,chung cư / căn hộ
"Bán căn hộ 90m 2 ngủ 2 wc tòa Tultaco 335 đường Cầu Giấy, LH An Minh",2,Quận Cầu  Giấy,"5,35 ",59,90,chung cư / căn hộ
Bán căn hộ 92m2 Tòa CT4 KĐT Trung Văn (Cây Xăng Tố Hữu),2,Quận Nam Từ Liêm,"5,15 ",56,92,chung cư / căn hộ
BÁN CĂN HỘ CC 73m2 TK2 Vin Tây Mỗ,2,Quận Nam Từ Liêm,"5,8 ",80,73,chung cư / căn hộ
"BÁN CĂN HỘ CC CAO CẤP MỚI MẶT ĐƯỜNG CẦU GIẤY DT 71M 2NGỦ GIÁ 4,85 ",2,Quận Cầu  Giấy,"4,85 ",68,71,chung cư / căn hộ
"Bán căn hộ cc Ruby city Ct3 Phúc Lợi. Long Biên 54,4m2 -2 ngủ -2vs",2,Quận Long Biên,"2,65 ",49,54,chung cư / căn hộ
BÁN CĂN HỘ CHUNG CƯ AMBER RIVERSIDE 622 MINH KHAI - 110M2 - SĐCC,3,Quận Hai Bà Trưng,"8,45 ",77,110,chung cư / căn hộ
Bán căn hộ chung cư CT5-ĐN3 KĐT Mỹ Đình 2 94m2 32WC,3,Quận Nam Từ Liêm,6,64,94,chung cư / căn hộ
"Bán căn hộ chung cư Handico 5, ngõ 622 Minh Khai, Hai Bà Trưng, HN.",2,Quận Hai Bà Trưng,"4,1 ",60,68,chung cư / căn hộ
BÁN CĂN HỘ CHUNG CƯ KHU ĐÔ THỊ TIMESCITY 458 MINH KHAI HAI BÀ TRƯNG,1,Quận Hai Bà Trưng,"5,15 ",103,50,chung cư / căn hộ
Bán căn hộ chung cư khu đô thị Yên Hoà 110m2 . 3 ngủ 2 vệ sinh,3,Quận Cầu  Giấy,6,55,110,chung cư / căn hộ
Bán căn hộ chung cư mini 50m2,2,Quận Tây Hồ,"1,5 ",30,50,chung cư / căn hộ
Bán căn hộ Chung cư phố Đội Cấn-Ba Đình 51m 2 ngủ,2,Quận Ba Đình,"1,85 ",36,51,chung cư / căn hộ
Bán căn hộ Chung cư phố Đội Cấn-Ba Đình 51m 2 ngủ,2,Quận Ba Đình,"1,85 ",36,51,chung cư / căn hộ
"Bán căn hộ chung cư Rice City Sông Hồng, Gia Quất, Thượng Thanh",2,Quận Long Biên,3,53,57,chung cư / căn hộ
"Bán căn hộ chung cư tại Việt Hưng_Long Biên:89.8m2_3,2wc.",3,Quận Long Biên,"3,999",44,90,chung cư / căn hộ
Bán căn hộ CT2 Mỹ Đình Plaza.,2,Quận Nam Từ Liêm,"5,05 ",71,71,chung cư / căn hộ
"BÁN CĂN HỘ DỊCH VỤ 7 TẦNG THANG MÁY,NHÀ MỚI ĐẸP,ĐẦY ĐỦ PCCC,DT 112M",10,Quận Bắc Từ Liêm,19,170,112,chung cư / căn hộ
Bán căn hộ dòng tiền 16 phòng khép kín doanh thu 80 triệu/tháng,10,Quận Hai Bà Trưng,"14,7 ",258,57,chung cư / căn hộ
Bán Căn Hộ Dòng Tiền 50m 11 Phòng Thuỵ Khuê Tây Hồ Giá Nhỉnh 13 ,10,Quận Tây Hồ,"13,3 ",266,50,chung cư / căn hộ
"Bán căn hộ đường Lạc Long Quân, Võ Chí Công view Hồ Tây vào ở luôn.",2,Quận Tây Hồ,"8,55 ",112,77,chung cư / căn hộ
"Bán căn hộ DV Xuân Đỉnh Cực đẹp,7 tầng,Dòng tiền 80tr/tháng,nhỉnh 12",10,Quận Bắc Từ Liêm,12,185,65,chung cư / căn hộ
Bán căn hộ Ecohome Phúc Lợi - Long Biên - 68m 2. 2wc,2,Quận Long Biên,"3,29 ",48,68,chung cư / căn hộ
Bán căn hộ Giáp Nhất - Quan Nhân - ô tô đỗ cửa,2,Quận Thanh Xuân,"1,85 ",34,55,chung cư / căn hộ
"Bán căn hộ khu 7,2ha Vĩnh Phúc 100m2, 3 ngủ, ô tô đỗ chân cầu thang",3,Quận Ba Đình,"5,85 ",59,100,chung cư / căn hộ
Bán căn hộ long biên,4,Quận Long Biên,"10,5 ",181,58,chung cư / căn hộ
"Bán căn hộ N4D Lê Văn Lương, DT 70m2, 2 ngủ 1 vệ sinh",2,Quận Cầu  Giấy,"4,4 ",61,72,chung cư / căn hộ
"Bán căn hộ Nguyễn Trãi - Ngã Tư Sở 2*52m , full đồ , ô tô đỗ cửa",2,Quận Thanh Xuân,"1,86 ",36,52,chung cư / căn hộ
"Bán căn hộ Nguyễn Trãi - Ngã Tư Sở 2*52m , full đồ , ô tô đỗ cửa",2,Quận Thanh Xuân,"1,86 ",36,52,chung cư / căn hộ
Bán căn hộ Nhà D8B - Tập thể công ty giống cây trồng Trung Ương I,1,Quận Đống Đa,"2,15 ",61,35,chung cư / căn hộ
Bán căn hộ Nhà D8B - Tập thể công ty giống cây trồng Trung Ương I,1,Quận Hà Đông ,"2,15 ",61,35,chung cư / căn hộ
BÁN CĂN HỘ nhỉnh 4 70m 2 2WC CHUNG CƯ AN BÌNH CITY PHẠM VĂN ĐỒNG,2,Quận Bắc Từ Liêm,"4,7 ",67,70,chung cư / căn hộ
BÁN căn hộ PHAN ĐÌNH GIÓT -TRƯỜNG CHINH 55m 2 ngủ sổ hồng,2,Quận Thanh Xuân,"2,1 ",38,55,chung cư / căn hộ
BÁN căn hộ PHAN ĐÌNH GIÓT -TRƯỜNG CHINH 55m 2 ngủ sổ hồng,2,Quận Thanh Xuân,"2,1 ",38,55,chung cư / căn hộ
BÁN căn hộ PHAN ĐÌNH GIÓT -TRƯỜNG CHINH 55m 2 ngủ sổ hồng,2,Quận Thanh Xuân,"2,1 ",38,55,chung cư / căn hộ
Bán căn hộ Phố Quan Nhân- Cự Lộc 54m 2 ngủ full đồ - oto đỗ cửa,2,Quận Thanh Xuân,"1,89 ",36,52,chung cư / căn hộ
Bán căn hộ Phố Quan Nhân- Cự Lộc 54m 2 ngủ full đồ - oto đỗ cửa,2,Quận Thanh Xuân,"1,89 ",36,52,chung cư / căn hộ
Bán căn hộ Phố Quan Nhân- Cự Lộc 54m 2 ngủ full đồ - oto đỗ cửa,2,Quận Thanh Xuân,"1,89 ",36,52,chung cư / căn hộ
"BÁN CĂN HỘ QUAN NHÂN, 2 Ô TÔ ĐỖ CỬA, VIEW ROYAL",2,Quận Thanh Xuân,"1,98 ",38,52,chung cư / căn hộ
"BÁN CĂN HỘ SIÊU ĐẸP KĐT VIỆT HƯNG_LONG BIÊN:75m2_2,2WC",2,Quận Long Biên,"3,099",41,75,chung cư / căn hộ
"Bán căn hộ siêu đẹp KĐT VIỆT HƯNG-LONG BIÊN: 75m2_2_2WC giá: 3,15 ",2,Quận Long Biên,"3,138",42,75,chung cư / căn hộ
Bán căn hộ studio 32m2 Tòa S4.01 Vinhomes Smart city,1,Quận Nam Từ Liêm,"2,35 ",73,32,chung cư / căn hộ
Bán Căn Hộ Tập Thể 100m Tầng 1 MP Hồ Đắc Di Đống Đa KD Đỉnh Giá 7.5,2,Quận Đống Đa,"7,5 ",75,100,chung cư / căn hộ
Bán Căn Hộ Tập Thể 100m Tầng 1 MP Hồ Đắc Di Đống Đa KD Đỉnh Giá 7.5,2,Quận Hà Đông ,"7,5 ",75,100,chung cư / căn hộ
"BÁN CĂN HỘ TẬP THỂ PHỐ ĐẠI LA, HAI BÀ TRƯNG-VỊ TRÍ ĐẸP, LÔ GÓC THOÁNG",3,Quận Hai Bà Trưng,"3,89 ",32,120,chung cư / căn hộ
"Bán căn hộ toà chung cư 789 mỹ đình, 32WC 108m2 4,9",3,Quận Nam Từ Liêm,"4,9 ",45,108,chung cư / căn hộ
Bán căn hộ vị trí đắc địa quận Ba Đình,2,Quận Ba Đình,10,116,86,chung cư / căn hộ
Bán căn hộ vinhome smartcity 43m2,2,Quận Nam Từ Liêm,"3,26 ",76,43,chung cư / căn hộ
Bán căn hộ vinhome smartcity 43m2,2,Quận Nam Từ Liêm,"3,26 ",76,43,chung cư / căn hộ
Bán căn hộ vinhome smartcity 43m2,2,Quận Nam Từ Liêm,"3,26 ",76,43,chung cư / căn hộ
"Bán căn hộ Võng Thị - Trích Sài , Tây Hồ, 2, ô tô đỗ cửa",2,Quận Tây Hồ,"1,98 ",36,55,chung cư / căn hộ
"Bán căn nhà đối diện trung tâm thương mại Aeon Mall Long Biên, ô tô đỗ",3,Quận Long Biên,"6,25 ",156,40,nhà ở
"Bán căn nhà ngõ 147 phố Tân Mai, 45m2, 5 tầng thang máy, ô tô đỗ cổng",4,Quận Hoàng Mai,"9,2 ",204,45,nhà ở
"Bán căn nhà ngõ 147 phố Tân Mai, 45m2, 5 tầng thang máy, ô tô đỗ cổng",4,Quận Hoàng Mai,"9,2 ",204,45,nhà ở
"BÁN CĂN NHÀ Ở MỖ LAO, THANH BÌNH, HÀ , GẦN OTO, 38m2x4T, 7.25 ",4,Quận Hà Đông ,"7,25 ",191,38,nhà ở
Bán căn nhà t1 biệt thự Pháp cổ nguyên bản đẹp,2,Quận Hoàn Kiếm,13,118,110,chung cư / căn hộ
Bán căn nhà t1 biệt thự Pháp cổ nguyên bản đẹp,2,Quận Hoàng Mai,13,118,110,chung cư / căn hộ
Bán căn nhà Tại Khu Công Nghệ Cao Hòa Lạc.Thạch Thất.Hà Nội,3,Huyện Thạch Thất,"2,65 ",17,158,nhà ở
BÁN CĂN SHOPHOUSE 10-TT2.2 CALYX RESIDENCE UY NỖ  ANH – CĐT 319 BQ,6,Huyện Đông Anh,"16,666",238,70,nhà ở
"Bán Căn Siêu Biệt Thự Nhỏ Tại Đại Thành , Giá *** Tại Khu Vực",4,Huyện Hoài Đức,"3,45 ",51,67,nhà ở
Bán căn Studio 58m 1 1WC tầng trung view đẹp chung cư Lancaster,1,Quận Đống Đa,"4,6 ",79,58,chung cư / căn hộ
Bán căn Studio 58m 1 1WC tầng trung view đẹp chung cư Lancaster,1,Quận Hà Đông ,"4,6 ",79,58,chung cư / căn hộ
"BÁN CĂN TẬP THỂ PHỐ VỌNG HÀ - HOÀN KIẾM , CHỈ 3.XX TY CÓ THƯƠNG LƯỢNG",2,Quận Hoàn Kiếm,"3,75 ",58,65,chung cư / căn hộ
"BÁN CĂN TẬP THỂ PHỐ VỌNG HÀ - HOÀN KIẾM , CHỈ 3.XX TY CÓ THƯƠNG LƯỢNG",2,Quận Hoàng Mai,"3,75 ",58,65,chung cư / căn hộ
"Bán căn Tình 42m2x3T, sát cầu Đại thành, Oto tải 2 tấn đỗ cửa.",3,Huyện Quốc Oai,"3,4 ",81,42,nhà ở
Bán căn TT 60m2 - 2  - Oto đỗ cổng - Quận HBT - 3 Bước ra phố Huế,2,Quận Hai Bà Trưng,"2,39 ",43,55,chung cư / căn hộ
"Bán Căn TT 60m2 - 2 - Láng Trung, Đống Đa",2,Quận Đống Đa,"3,2 ",53,60,chung cư / căn hộ
"Bán Căn TT 60m2 - 2 - Láng Trung, Đống Đa",2,Quận Hà Đông ,"3,2 ",53,60,chung cư / căn hộ
"Bán Căn TT 60m2 - 2 - Nguyễn Chí Thanh, Đống Đa",2,Quận Đống Đa,"3,25 ",54,60,chung cư / căn hộ
"Bán Căn TT 60m2 - 2 - Nguyễn Chí Thanh, Đống Đa",2,Quận Hà Đông ,"3,25 ",54,60,chung cư / căn hộ
"Bán CC 86m2 Bắc Từ Liêm 2 Ngủ, 2WC, View Công Viên Hòa Bình, 3.98 ",2,Quận Bắc Từ Liêm,"3,98 ",46,86,chung cư / căn hộ
BÁN CC 87M GIÁ 4.65 KĐT TP GIAO LƯU–BẮC TỪ LIÊM-NỘI THẤT XỊN-Ở NGAY,3,Quận Bắc Từ Liêm,"4,65 ",53,87,chung cư / căn hộ
"BÁN CC HỌC VIÊN HẬU CẦN, NGỌC THỤY 110M, LÔ GÓC - 3 - VIP - 4  HƠN",3,Quận Long Biên,"4,18 ",38,110,chung cư / căn hộ
Bán cc vinaconex 12 Vũ Trọng Phụng 108m- 6 150,3,Quận Thanh Xuân,"6,15 ",57,108,chung cư / căn hộ
Bán CCCC Tháp Cán Bộ - Học Viện Quốc Phòng - Căn Đẹp nhất nhì tầng.,3,Quận Tây Hồ,"6,89 ",65,106,chung cư / căn hộ
BÁN CCMN 11 PHÒNG KHÉP KÍN FULL ĐỒ – BA GAC ĐỖ CỬA – THANG MÁY ÊM RU,10,Quận Thanh Xuân,"9,2 ",230,40,chung cư / căn hộ
